MAP 474.360998 6 0x53300000 0xffffb660800f7000 0x800 0x0 0
W 4 474.361090 6 0x533000a8 0xffffffff 0x0 0
R 4 474.361103 6 0x533000a8 0xf 0x0 0
W 4 474.361104 6 0x533000ac 0xffffffff 0x0 0
W 4 474.361106 6 0x53300098 0xffffffff 0x0 0
R 4 474.361109 6 0x53300098 0xff 0x0 0
W 4 474.361110 6 0x5330009c 0xffffffff 0x0 0
R 4 474.361114 6 0x53300020 0xf000a222 0x0 0
R 4 474.361117 6 0x53300024 0x110666 0x0 0
R 4 474.361121 6 0x53300028 0x554589e2 0x0 0
W 4 474.361130 6 0x53300050 0x10000 0x0 0
R 4 474.361136 6 0x53300050 0x10000 0x0 0
R 4 474.363889 6 0x53300050 0x0 0x0 0
W 4 474.363892 6 0x53300050 0xc0000 0x0 0
R 4 474.363895 6 0x53300000 0x1010000 0x0 0
R 4 474.415887 6 0x53300050 0xc0000 0x0 0
W 4 474.415890 6 0x53300054 0x40000000 0x0 0
W 4 474.415891 6 0x53300064 0x123f800 0x0 0
W 4 474.415892 6 0x533000e0 0x300000 0x0 0
W 4 474.415893 6 0x53300008 0xc8082f 0x0 0
W 4 474.415895 6 0x53300404 0x10000000 0x0 0
W 4 474.415896 6 0x53300424 0x10000000 0x0 0
W 4 474.415897 6 0x53300444 0x10000000 0x0 0
W 4 474.415898 6 0x53300464 0x10000000 0x0 0
R 4 474.415901 6 0x53300000 0x1010000 0x0 0
W 4 474.415902 6 0x533000dc 0x3f 0x0 0
R 4 474.415905 6 0x533000dc 0x3f 0x0 0
W 4 474.415906 6 0x533000dc 0x0 0x0 0
W 4 474.415907 6 0x53300120 0x10000 0x0 0
W 4 474.415908 6 0x53300084 0xffffffff 0x0 0
W 4 474.415909 6 0x5330008c 0xffffffff 0x0 0
R 4 474.415912 6 0x53300050 0xc0000 0x0 0
W 4 474.415913 6 0x533000ec 0x8400 0x0 0
R 4 474.415916 6 0x533000ec 0x84010400 0x0 0
W 4 474.415918 6 0x533000ec 0x44c1 0x0 0
R 4 474.415921 6 0x533000ec 0x840104c1 0x0 0
W 4 474.415923 6 0x53300018 0x0 0x0 0
W 4 474.415924 6 0x53300020 0xf000a222 0x0 0
W 4 474.415925 6 0x53300034 0x12d6000 0x0 0
W 4 474.415926 6 0x53300100 0x80000000 0x0 0
W 4 474.415927 6 0x53300088 0x838501f3 0x0 0
W 4 474.415928 6 0x53300050 0x80020000 0x0 0
W 4 474.415929 6 0x533000e0 0x600 0x0 0
W 4 474.415930 6 0x533001c0 0x1000 0x0 0
W 4 474.415931 6 0x533001c0 0x1000 0x0 0
W 4 474.415932 6 0x533001c0 0x1000 0x0 0
W 4 474.415933 6 0x533001c0 0x1000 0x0 0
W 4 474.415935 6 0x533001c0 0x1000 0x0 0
W 4 474.415936 6 0x533001c0 0x1000 0x0 0
W 4 474.415937 6 0x533001c0 0x1000 0x0 0
W 4 474.415938 6 0x533001c0 0x1000 0x0 0
W 4 474.415939 6 0x533001cc 0x123f001 0x0 0
W 4 474.415940 6 0x533001c0 0x8000 0x0 0
W 4 474.415941 6 0x533001e0 0x1000 0x0 0
W 4 474.415942 6 0x533001e0 0x1000 0x0 0
W 4 474.415943 6 0x533001e0 0x1000 0x0 0
W 4 474.415944 6 0x533001e0 0x1000 0x0 0
W 4 474.415945 6 0x533001e0 0x1000 0x0 0
W 4 474.415946 6 0x533001e0 0x1000 0x0 0
W 4 474.415947 6 0x533001e0 0x1000 0x0 0
W 4 474.415948 6 0x533001e0 0x1000 0x0 0
W 4 474.415949 6 0x533001ec 0x123f401 0x0 0
W 4 474.415950 6 0x533001e0 0x8000 0x0 0
R 4 474.415953 6 0x53300000 0x1010000 0x0 0
R 4 474.415957 6 0x53300000 0x1010000 0x0 0
R 4 474.415960 6 0x53300120 0x0 0x0 0
W 4 474.415967 6 0x533000ec 0x8100 0x0 0
R 4 474.415970 6 0x533000ec 0x813f0100 0x0 0
W 4 474.415971 6 0x533000ec 0x8500 0x0 0
R 4 474.415974 6 0x533000ec 0x85000500 0x0 0
W 4 474.415975 6 0x533000ec 0x4540 0x0 0
R 4 474.415978 6 0x533000ec 0x85000540 0x0 0
R 4 474.416006 6 0x53300084 0x10010 0x0 0
W 4 474.416007 6 0x53300084 0x10010 0x0 0
R 4 474.416010 6 0x53300000 0x1010000 0x0 0
R 4 474.416044 6 0x533000e8 0xc800ffc0 0x0 0
W 4 474.416045 6 0x533000e0 0x200000 0x0 0
R 4 474.416048 6 0x53300068 0x1000c 0x0 0
R 4 474.416051 6 0x53300068 0x1000c 0x0 0
W 4 474.416052 6 0x53300184 0x8000 0x0 0
R 4 474.416055 6 0x53300180 0x0 0x0 0
W 4 474.416056 6 0x533001a4 0x8000 0x0 0
R 4 474.416059 6 0x533001a0 0x0 0x0 0
W 4 474.416060 6 0x53300084 0x20000 0x0 0
W 4 474.416061 6 0x53300020 0xf000a222 0x0 0
W 4 474.416063 6 0x53300018 0x404d116 0x0 0
R 4 474.416068 6 0x533000f0 0x1a7a730c 0x0 0
R 4 474.416071 6 0x533000f0 0x1a7a7356 0x0 0
R 4 474.416088 6 0x533000f0 0x1a7a7502 0x0 0
R 4 474.416091 6 0x533000f0 0x1a7a754c 0x0 0
R 4 474.416098 6 0x533000f0 0x1a7a7603 0x0 0
R 4 474.416101 6 0x533000f0 0x1a7a764b 0x0 0
R 4 474.416104 6 0x533000f0 0x1a7a7694 0x0 0
W 4 474.416106 6 0x5330000c 0xffc0 0x0 0
W 4 474.416107 6 0x53300010 0x3f 0x0 0
W 4 474.416108 6 0x53300014 0x0 0x0 0
R 4 474.416111 6 0x53300014 0x80000000 0x0 0
R 4 474.416114 6 0x5330000c 0x3f 0x0 0
R 4 474.416117 6 0x533000f0 0x1a7a77cb 0x0 0
R 4 474.416124 6 0x533000f0 0x1a7a7880 0x0 0
R 4 474.416127 6 0x533000f0 0x1a7a78ca 0x0 0
R 4 474.416130 6 0x533000f0 0x1a7a7912 0x0 0
W 8 474.443643 5 0x50540000 0x0 0x0 0
W 8 474.443649 5 0x50540008 0x0 0x0 0
W 8 474.443650 5 0x50540010 0x0 0x0 0
W 8 474.443651 5 0x50540018 0x0 0x0 0
W 8 474.443652 5 0x50540020 0x0 0x0 0
W 8 474.443654 5 0x50540028 0x0 0x0 0
W 8 474.443655 5 0x50540030 0x0 0x0 0
W 8 474.443656 5 0x50540038 0x0 0x0 0
W 8 474.443657 5 0x50540040 0x0 0x0 0
W 8 474.443659 5 0x50540048 0x0 0x0 0
W 8 474.443660 5 0x50540050 0x0 0x0 0
W 8 474.443661 5 0x50540058 0x0 0x0 0
W 8 474.443662 5 0x50540060 0x0 0x0 0
W 8 474.443663 5 0x50540068 0x0 0x0 0
W 8 474.443664 5 0x50540070 0x0 0x0 0
W 8 474.443665 5 0x50540078 0x0 0x0 0
W 8 474.443666 5 0x50540080 0x0 0x0 0
W 8 474.443667 5 0x50540088 0x0 0x0 0
W 8 474.443669 5 0x50540090 0x0 0x0 0
W 8 474.443670 5 0x50540098 0x0 0x0 0
W 8 474.443671 5 0x505400a0 0x0 0x0 0
W 8 474.443672 5 0x505400a8 0x0 0x0 0
W 8 474.443673 5 0x505400b0 0x0 0x0 0
W 8 474.443674 5 0x505400b8 0x0 0x0 0
W 8 474.443675 5 0x505400c0 0x0 0x0 0
W 8 474.443676 5 0x505400c8 0x0 0x0 0
W 8 474.443677 5 0x505400d0 0x0 0x0 0
W 8 474.443678 5 0x505400d8 0x0 0x0 0
W 8 474.443679 5 0x505400e0 0x0 0x0 0
W 8 474.443681 5 0x505400e8 0x0 0x0 0
W 8 474.443682 5 0x505400f0 0x0 0x0 0
W 8 474.443683 5 0x505400f8 0x0 0x0 0
W 8 474.443684 5 0x50540100 0x0 0x0 0
W 8 474.443685 5 0x50540108 0x0 0x0 0
W 8 474.443686 5 0x50540110 0x0 0x0 0
W 8 474.443687 5 0x50540118 0x0 0x0 0
W 8 474.443689 5 0x50540120 0x0 0x0 0
W 8 474.443690 5 0x50540128 0x0 0x0 0
W 8 474.443691 5 0x50540130 0x0 0x0 0
W 8 474.443692 5 0x50540138 0x0 0x0 0
W 8 474.443693 5 0x50540140 0x0 0x0 0
W 8 474.443694 5 0x50540148 0x0 0x0 0
W 8 474.443695 5 0x50540150 0x0 0x0 0
W 8 474.443696 5 0x50540158 0x0 0x0 0
W 8 474.443697 5 0x50540160 0x0 0x0 0
W 8 474.443698 5 0x50540168 0x0 0x0 0
W 8 474.443699 5 0x50540170 0x0 0x0 0
W 8 474.443701 5 0x50540178 0x0 0x0 0
W 8 474.443702 5 0x50540180 0x0 0x0 0
W 8 474.443703 5 0x50540188 0x0 0x0 0
W 8 474.443704 5 0x50540190 0x0 0x0 0
W 8 474.443705 5 0x50540198 0x0 0x0 0
W 8 474.443706 5 0x505401a0 0x0 0x0 0
W 8 474.443707 5 0x505401a8 0x0 0x0 0
W 8 474.443708 5 0x505401b0 0x0 0x0 0
W 8 474.443709 5 0x505401b8 0x0 0x0 0
W 8 474.443710 5 0x505401c0 0x0 0x0 0
W 8 474.443711 5 0x505401c8 0x0 0x0 0
W 8 474.443712 5 0x505401d0 0x0 0x0 0
W 8 474.443714 5 0x505401d8 0x0 0x0 0
W 8 474.443715 5 0x505401e0 0x0 0x0 0
W 8 474.443716 5 0x505401e8 0x0 0x0 0
W 8 474.443717 5 0x505401f0 0x0 0x0 0
W 8 474.443718 5 0x505401f8 0x0 0x0 0
W 8 474.443719 5 0x50540200 0x0 0x0 0
W 8 474.443720 5 0x50540208 0x0 0x0 0
W 8 474.443721 5 0x50540210 0x0 0x0 0
W 8 474.443722 5 0x50540218 0x0 0x0 0
W 8 474.443723 5 0x50540220 0x0 0x0 0
W 8 474.443724 5 0x50540228 0x0 0x0 0
W 8 474.443725 5 0x50540230 0x0 0x0 0
W 8 474.443727 5 0x50540238 0x0 0x0 0
W 8 474.443728 5 0x50540240 0x0 0x0 0
W 8 474.443729 5 0x50540248 0x0 0x0 0
W 8 474.443730 5 0x50540250 0x0 0x0 0
W 8 474.443731 5 0x50540258 0x0 0x0 0
W 8 474.443732 5 0x50540260 0x0 0x0 0
W 8 474.443734 5 0x50540268 0x0 0x0 0
W 8 474.443735 5 0x50540270 0x0 0x0 0
W 8 474.443736 5 0x50540278 0x0 0x0 0
W 8 474.443737 5 0x50540280 0x0 0x0 0
W 8 474.443738 5 0x50540288 0x0 0x0 0
W 8 474.443739 5 0x50540290 0x0 0x0 0
W 8 474.443740 5 0x50540298 0x0 0x0 0
W 8 474.443741 5 0x505402a0 0x0 0x0 0
W 8 474.443743 5 0x505402a8 0x0 0x0 0
W 8 474.443744 5 0x505402b0 0x0 0x0 0
W 8 474.443745 5 0x505402b8 0x0 0x0 0
W 8 474.443746 5 0x505402c0 0x0 0x0 0
W 8 474.443747 5 0x505402c8 0x0 0x0 0
W 8 474.443748 5 0x505402d0 0x0 0x0 0
W 8 474.443749 5 0x505402d8 0x0 0x0 0
W 8 474.443750 5 0x505402e0 0x0 0x0 0
W 8 474.443751 5 0x505402e8 0x0 0x0 0
W 8 474.443752 5 0x505402f0 0x0 0x0 0
W 8 474.443753 5 0x505402f8 0x0 0x0 0
W 8 474.443755 5 0x50540300 0x0 0x0 0
W 8 474.443756 5 0x50540308 0x0 0x0 0
W 8 474.443757 5 0x50540310 0x0 0x0 0
W 8 474.443758 5 0x50540318 0x0 0x0 0
W 8 474.443759 5 0x50540320 0x0 0x0 0
W 8 474.443760 5 0x50540328 0x0 0x0 0
W 8 474.443761 5 0x50540330 0x0 0x0 0
W 8 474.443762 5 0x50540338 0x0 0x0 0
W 8 474.443763 5 0x50540340 0x0 0x0 0
W 8 474.443765 5 0x50540348 0x0 0x0 0
W 8 474.443766 5 0x50540350 0x0 0x0 0
W 8 474.443767 5 0x50540358 0x0 0x0 0
W 8 474.443768 5 0x50540360 0x0 0x0 0
W 8 474.443769 5 0x50540368 0x0 0x0 0
W 8 474.443770 5 0x50540370 0x0 0x0 0
W 8 474.443771 5 0x50540378 0x0 0x0 0
W 8 474.443772 5 0x50540380 0x0 0x0 0
W 8 474.443773 5 0x50540388 0x0 0x0 0
W 8 474.443775 5 0x50540390 0x0 0x0 0
W 8 474.443776 5 0x50540398 0x0 0x0 0
W 8 474.443777 5 0x505403a0 0x0 0x0 0
W 8 474.443778 5 0x505403a8 0x0 0x0 0
W 8 474.443779 5 0x505403b0 0x0 0x0 0
W 8 474.443780 5 0x505403b8 0x0 0x0 0
W 8 474.443781 5 0x505403c0 0x0 0x0 0
W 8 474.443782 5 0x505403c8 0x0 0x0 0
W 8 474.443783 5 0x505403d0 0x0 0x0 0
W 8 474.443784 5 0x505403d8 0x0 0x0 0
W 8 474.443785 5 0x505403e0 0x0 0x0 0
W 8 474.443787 5 0x505403e8 0x0 0x0 0
W 8 474.443788 5 0x505403f0 0x0 0x0 0
W 8 474.443789 5 0x505403f8 0x0 0x0 0
W 8 474.443790 5 0x50540400 0x0 0x0 0
W 8 474.443791 5 0x50540408 0x0 0x0 0
W 8 474.443792 5 0x50540410 0x0 0x0 0
W 8 474.443793 5 0x50540418 0x0 0x0 0
W 8 474.443794 5 0x50540420 0x0 0x0 0
W 8 474.443796 5 0x50540428 0x0 0x0 0
W 8 474.443797 5 0x50540430 0x0 0x0 0
W 8 474.443798 5 0x50540438 0x0 0x0 0
W 8 474.443799 5 0x50540440 0x0 0x0 0
W 8 474.443800 5 0x50540448 0x0 0x0 0
W 8 474.443801 5 0x50540450 0x0 0x0 0
W 8 474.443802 5 0x50540458 0x0 0x0 0
W 8 474.443803 5 0x50540460 0x0 0x0 0
W 8 474.443805 5 0x50540468 0x0 0x0 0
W 8 474.443806 5 0x50540470 0x0 0x0 0
W 8 474.443807 5 0x50540478 0x0 0x0 0
W 8 474.443808 5 0x50540480 0x0 0x0 0
W 8 474.443809 5 0x50540488 0x0 0x0 0
W 8 474.443810 5 0x50540490 0x0 0x0 0
W 8 474.443811 5 0x50540498 0x0 0x0 0
W 8 474.443812 5 0x505404a0 0x0 0x0 0
W 8 474.443813 5 0x505404a8 0x0 0x0 0
W 8 474.443814 5 0x505404b0 0x0 0x0 0
W 8 474.443815 5 0x505404b8 0x0 0x0 0
W 8 474.443816 5 0x505404c0 0x0 0x0 0
W 8 474.443818 5 0x505404c8 0x0 0x0 0
W 8 474.443819 5 0x505404d0 0x0 0x0 0
W 8 474.443820 5 0x505404d8 0x0 0x0 0
W 8 474.443821 5 0x505404e0 0x0 0x0 0
W 8 474.443822 5 0x505404e8 0x0 0x0 0
W 8 474.443823 5 0x505404f0 0x0 0x0 0
W 8 474.443824 5 0x505404f8 0x0 0x0 0
W 8 474.443825 5 0x50540500 0x0 0x0 0
W 8 474.443826 5 0x50540508 0x0 0x0 0
W 8 474.443827 5 0x50540510 0x0 0x0 0
W 8 474.443828 5 0x50540518 0x0 0x0 0
W 8 474.443829 5 0x50540520 0x0 0x0 0
W 8 474.443831 5 0x50540528 0x0 0x0 0
W 8 474.443832 5 0x50540530 0x0 0x0 0
W 8 474.443833 5 0x50540538 0x0 0x0 0
W 8 474.443834 5 0x50540540 0x0 0x0 0
W 8 474.443835 5 0x50540548 0x0 0x0 0
W 8 474.443836 5 0x50540550 0x0 0x0 0
W 8 474.443837 5 0x50540558 0x0 0x0 0
W 8 474.443838 5 0x50540560 0x0 0x0 0
W 8 474.443839 5 0x50540568 0x0 0x0 0
W 8 474.443841 5 0x50540570 0x0 0x0 0
W 8 474.443842 5 0x50540578 0x0 0x0 0
W 8 474.443843 5 0x50540580 0x0 0x0 0
W 8 474.443844 5 0x50540588 0x0 0x0 0
W 8 474.443845 5 0x50540590 0x0 0x0 0
W 8 474.443846 5 0x50540598 0x0 0x0 0
W 8 474.443847 5 0x505405a0 0x0 0x0 0
W 8 474.443848 5 0x505405a8 0x0 0x0 0
W 8 474.443849 5 0x505405b0 0x0 0x0 0
W 8 474.443851 5 0x505405b8 0x0 0x0 0
W 8 474.443852 5 0x505405c0 0x0 0x0 0
W 8 474.443853 5 0x505405c8 0x0 0x0 0
W 8 474.443854 5 0x505405d0 0x0 0x0 0
W 8 474.443855 5 0x505405d8 0x0 0x0 0
W 8 474.443856 5 0x505405e0 0x0 0x0 0
W 8 474.443857 5 0x505405e8 0x0 0x0 0
W 8 474.443858 5 0x505405f0 0x0 0x0 0
W 8 474.443859 5 0x505405f8 0x0 0x0 0
W 8 474.443860 5 0x50540600 0x0 0x0 0
W 8 474.443861 5 0x50540608 0x0 0x0 0
W 8 474.443863 5 0x50540610 0x0 0x0 0
W 8 474.443864 5 0x50540618 0x0 0x0 0
W 8 474.443865 5 0x50540620 0x0 0x0 0
W 8 474.443866 5 0x50540628 0x0 0x0 0
W 8 474.443867 5 0x50540630 0x0 0x0 0
W 8 474.443868 5 0x50540638 0x0 0x0 0
W 8 474.443869 5 0x50540640 0x0 0x0 0
W 8 474.443870 5 0x50540648 0x0 0x0 0
W 8 474.443871 5 0x50540650 0x0 0x0 0
W 8 474.443872 5 0x50540658 0x0 0x0 0
W 8 474.443876 5 0x50540660 0x0 0x0 0
W 8 474.443877 5 0x50540668 0x0 0x0 0
W 8 474.443878 5 0x50540670 0x0 0x0 0
W 8 474.443879 5 0x50540678 0x0 0x0 0
W 8 474.443880 5 0x50540680 0x0 0x0 0
W 8 474.443881 5 0x50540688 0x0 0x0 0
W 8 474.443882 5 0x50540690 0x0 0x0 0
W 8 474.443884 5 0x50540698 0x0 0x0 0
W 8 474.443885 5 0x505406a0 0x0 0x0 0
W 8 474.443886 5 0x505406a8 0x0 0x0 0
W 8 474.443887 5 0x505406b0 0x0 0x0 0
W 8 474.443888 5 0x505406b8 0x0 0x0 0
W 8 474.443889 5 0x505406c0 0x0 0x0 0
W 8 474.443890 5 0x505406c8 0x0 0x0 0
W 8 474.443891 5 0x505406d0 0x0 0x0 0
W 8 474.443892 5 0x505406d8 0x0 0x0 0
W 8 474.443893 5 0x505406e0 0x0 0x0 0
W 8 474.443894 5 0x505406e8 0x0 0x0 0
W 8 474.443895 5 0x505406f0 0x0 0x0 0
W 8 474.443897 5 0x505406f8 0x0 0x0 0
W 8 474.443898 5 0x50540700 0x0 0x0 0
W 8 474.443899 5 0x50540708 0x0 0x0 0
W 8 474.443900 5 0x50540710 0x0 0x0 0
W 8 474.443901 5 0x50540718 0x0 0x0 0
W 8 474.443902 5 0x50540720 0x0 0x0 0
W 8 474.443903 5 0x50540728 0x0 0x0 0
W 8 474.443904 5 0x50540730 0x0 0x0 0
W 8 474.443905 5 0x50540738 0x0 0x0 0
W 8 474.443906 5 0x50540740 0x0 0x0 0
W 8 474.443907 5 0x50540748 0x0 0x0 0
W 8 474.443908 5 0x50540750 0x0 0x0 0
W 8 474.443910 5 0x50540758 0x0 0x0 0
W 8 474.443911 5 0x50540760 0x0 0x0 0
W 8 474.443912 5 0x50540768 0x0 0x0 0
W 8 474.443913 5 0x50540770 0x0 0x0 0
W 8 474.443914 5 0x50540778 0x0 0x0 0
W 8 474.443915 5 0x50540780 0x0 0x0 0
W 8 474.443916 5 0x50540788 0x0 0x0 0
W 8 474.443917 5 0x50540790 0x0 0x0 0
W 8 474.443918 5 0x50540798 0x0 0x0 0
W 8 474.443919 5 0x505407a0 0x0 0x0 0
W 8 474.443920 5 0x505407a8 0x0 0x0 0
W 8 474.443921 5 0x505407b0 0x0 0x0 0
W 8 474.443923 5 0x505407b8 0x0 0x0 0
W 8 474.443924 5 0x505407c0 0x0 0x0 0
W 8 474.443925 5 0x505407c8 0x0 0x0 0
W 8 474.443926 5 0x505407d0 0x0 0x0 0
W 8 474.443927 5 0x505407d8 0x0 0x0 0
W 8 474.443928 5 0x505407e0 0x0 0x0 0
W 8 474.443929 5 0x505407e8 0x0 0x0 0
W 8 474.443930 5 0x505407f0 0x0 0x0 0
W 8 474.443931 5 0x505407f8 0x0 0x0 0
W 8 474.443932 5 0x50540800 0x0 0x0 0
W 8 474.443933 5 0x50540808 0x0 0x0 0
W 8 474.443935 5 0x50540810 0x0 0x0 0
W 8 474.443936 5 0x50540818 0x0 0x0 0
W 8 474.443937 5 0x50540820 0x0 0x0 0
W 8 474.443938 5 0x50540828 0x0 0x0 0
W 8 474.443939 5 0x50540830 0x0 0x0 0
W 8 474.443940 5 0x50540838 0x0 0x0 0
W 8 474.443941 5 0x50540840 0x0 0x0 0
W 8 474.443942 5 0x50540848 0x0 0x0 0
W 8 474.443943 5 0x50540850 0x0 0x0 0
W 8 474.443944 5 0x50540858 0x0 0x0 0
W 8 474.443946 5 0x50540860 0x0 0x0 0
W 8 474.443947 5 0x50540868 0x0 0x0 0
W 8 474.443948 5 0x50540870 0x0 0x0 0
W 8 474.443949 5 0x50540878 0x0 0x0 0
W 8 474.443950 5 0x50540880 0x0 0x0 0
W 8 474.443951 5 0x50540888 0x0 0x0 0
W 8 474.443952 5 0x50540890 0x0 0x0 0
W 8 474.443953 5 0x50540898 0x0 0x0 0
W 8 474.443954 5 0x505408a0 0x0 0x0 0
W 8 474.443955 5 0x505408a8 0x0 0x0 0
W 8 474.443956 5 0x505408b0 0x0 0x0 0
W 8 474.443957 5 0x505408b8 0x0 0x0 0
W 8 474.443959 5 0x505408c0 0x0 0x0 0
W 8 474.443960 5 0x505408c8 0x0 0x0 0
W 8 474.443961 5 0x505408d0 0x0 0x0 0
W 8 474.443962 5 0x505408d8 0x0 0x0 0
W 8 474.443963 5 0x505408e0 0x0 0x0 0
W 8 474.443964 5 0x505408e8 0x0 0x0 0
W 8 474.443965 5 0x505408f0 0x0 0x0 0
W 8 474.443966 5 0x505408f8 0x0 0x0 0
W 8 474.443967 5 0x50540900 0x0 0x0 0
W 8 474.443968 5 0x50540908 0x0 0x0 0
W 8 474.443969 5 0x50540910 0x0 0x0 0
W 8 474.443970 5 0x50540918 0x0 0x0 0
W 8 474.443972 5 0x50540920 0x0 0x0 0
W 8 474.443973 5 0x50540928 0x0 0x0 0
W 8 474.443974 5 0x50540930 0x0 0x0 0
W 8 474.443975 5 0x50540938 0x0 0x0 0
W 8 474.443976 5 0x50540940 0x0 0x0 0
W 8 474.443977 5 0x50540948 0x0 0x0 0
W 8 474.443978 5 0x50540950 0x0 0x0 0
W 8 474.443979 5 0x50540958 0x0 0x0 0
W 8 474.443980 5 0x50540960 0x0 0x0 0
W 8 474.443981 5 0x50540968 0x0 0x0 0
W 8 474.443982 5 0x50540970 0x0 0x0 0
W 8 474.443983 5 0x50540978 0x0 0x0 0
W 8 474.443985 5 0x50540980 0x0 0x0 0
W 8 474.443986 5 0x50540988 0x0 0x0 0
W 8 474.443987 5 0x50540990 0x0 0x0 0
W 8 474.443988 5 0x50540998 0x0 0x0 0
W 8 474.443989 5 0x505409a0 0x0 0x0 0
W 8 474.443990 5 0x505409a8 0x0 0x0 0
W 8 474.443991 5 0x505409b0 0x0 0x0 0
W 8 474.443992 5 0x505409b8 0x0 0x0 0
W 8 474.443993 5 0x505409c0 0x0 0x0 0
W 8 474.443994 5 0x505409c8 0x0 0x0 0
W 8 474.443995 5 0x505409d0 0x0 0x0 0
W 8 474.443996 5 0x505409d8 0x0 0x0 0
W 8 474.443998 5 0x505409e0 0x0 0x0 0
W 8 474.443999 5 0x505409e8 0x0 0x0 0
W 8 474.444000 5 0x505409f0 0x0 0x0 0
W 8 474.444001 5 0x505409f8 0x0 0x0 0
W 8 474.444002 5 0x50540a00 0x0 0x0 0
W 8 474.444003 5 0x50540a08 0x0 0x0 0
W 8 474.444004 5 0x50540a10 0x0 0x0 0
W 8 474.444005 5 0x50540a18 0x0 0x0 0
W 8 474.444006 5 0x50540a20 0x0 0x0 0
W 8 474.444007 5 0x50540a28 0x0 0x0 0
W 8 474.444008 5 0x50540a30 0x0 0x0 0
W 8 474.444009 5 0x50540a38 0x0 0x0 0
W 8 474.444011 5 0x50540a40 0x0 0x0 0
W 8 474.444012 5 0x50540a48 0x0 0x0 0
W 8 474.444013 5 0x50540a50 0x0 0x0 0
W 8 474.444014 5 0x50540a58 0x0 0x0 0
W 8 474.444015 5 0x50540a60 0x0 0x0 0
W 8 474.444016 5 0x50540a68 0x0 0x0 0
W 8 474.444017 5 0x50540a70 0x0 0x0 0
W 8 474.444018 5 0x50540a78 0x0 0x0 0
W 8 474.444019 5 0x50540a80 0x0 0x0 0
W 8 474.444020 5 0x50540a88 0x0 0x0 0
W 8 474.444021 5 0x50540a90 0x0 0x0 0
W 8 474.444022 5 0x50540a98 0x0 0x0 0
W 8 474.444024 5 0x50540aa0 0x0 0x0 0
W 8 474.444025 5 0x50540aa8 0x0 0x0 0
W 8 474.444026 5 0x50540ab0 0x0 0x0 0
W 8 474.444027 5 0x50540ab8 0x0 0x0 0
W 8 474.444028 5 0x50540ac0 0x0 0x0 0
W 8 474.444029 5 0x50540ac8 0x0 0x0 0
W 8 474.444030 5 0x50540ad0 0x0 0x0 0
W 8 474.444031 5 0x50540ad8 0x0 0x0 0
W 8 474.444032 5 0x50540ae0 0x0 0x0 0
W 8 474.444033 5 0x50540ae8 0x0 0x0 0
W 8 474.444034 5 0x50540af0 0x0 0x0 0
W 8 474.444036 5 0x50540af8 0x0 0x0 0
W 8 474.444037 5 0x50540b00 0x0 0x0 0
W 8 474.444038 5 0x50540b08 0x0 0x0 0
W 8 474.444039 5 0x50540b10 0x0 0x0 0
W 8 474.444040 5 0x50540b18 0x0 0x0 0
W 8 474.444041 5 0x50540b20 0x0 0x0 0
W 8 474.444042 5 0x50540b28 0x0 0x0 0
W 8 474.444043 5 0x50540b30 0x0 0x0 0
W 8 474.444044 5 0x50540b38 0x0 0x0 0
W 8 474.444045 5 0x50540b40 0x0 0x0 0
W 8 474.444046 5 0x50540b48 0x0 0x0 0
W 8 474.444048 5 0x50540b50 0x0 0x0 0
W 8 474.444049 5 0x50540b58 0x0 0x0 0
W 8 474.444050 5 0x50540b60 0x0 0x0 0
W 8 474.444051 5 0x50540b68 0x0 0x0 0
W 8 474.444052 5 0x50540b70 0x0 0x0 0
W 8 474.444053 5 0x50540b78 0x0 0x0 0
W 8 474.444054 5 0x50540b80 0x0 0x0 0
W 8 474.444055 5 0x50540b88 0x0 0x0 0
W 8 474.444056 5 0x50540b90 0x0 0x0 0
W 8 474.444057 5 0x50540b98 0x0 0x0 0
W 8 474.444058 5 0x50540ba0 0x0 0x0 0
W 8 474.444059 5 0x50540ba8 0x0 0x0 0
W 8 474.444061 5 0x50540bb0 0x0 0x0 0
W 8 474.444062 5 0x50540bb8 0x0 0x0 0
W 8 474.444063 5 0x50540bc0 0x0 0x0 0
W 8 474.444064 5 0x50540bc8 0x0 0x0 0
W 8 474.444065 5 0x50540bd0 0x0 0x0 0
W 8 474.444066 5 0x50540bd8 0x0 0x0 0
W 8 474.444067 5 0x50540be0 0x0 0x0 0
W 8 474.444068 5 0x50540be8 0x0 0x0 0
W 8 474.444069 5 0x50540bf0 0x0 0x0 0
W 8 474.444070 5 0x50540bf8 0x0 0x0 0
W 8 474.444071 5 0x50540c00 0x0 0x0 0
W 8 474.444072 5 0x50540c08 0x0 0x0 0
W 8 474.444074 5 0x50540c10 0x0 0x0 0
W 8 474.444075 5 0x50540c18 0x0 0x0 0
W 8 474.444076 5 0x50540c20 0x0 0x0 0
W 8 474.444077 5 0x50540c28 0x0 0x0 0
W 8 474.444078 5 0x50540c30 0x0 0x0 0
W 8 474.444079 5 0x50540c38 0x0 0x0 0
W 8 474.444080 5 0x50540c40 0x0 0x0 0
W 8 474.444081 5 0x50540c48 0x0 0x0 0
W 8 474.444082 5 0x50540c50 0x0 0x0 0
W 8 474.444083 5 0x50540c58 0x0 0x0 0
W 8 474.444084 5 0x50540c60 0x0 0x0 0
W 8 474.444085 5 0x50540c68 0x0 0x0 0
W 8 474.444087 5 0x50540c70 0x0 0x0 0
W 8 474.444088 5 0x50540c78 0x0 0x0 0
W 8 474.444089 5 0x50540c80 0x0 0x0 0
W 8 474.444090 5 0x50540c88 0x0 0x0 0
W 8 474.444091 5 0x50540c90 0x0 0x0 0
W 8 474.444092 5 0x50540c98 0x0 0x0 0
W 8 474.444093 5 0x50540ca0 0x0 0x0 0
W 8 474.444094 5 0x50540ca8 0x0 0x0 0
W 8 474.444095 5 0x50540cb0 0x0 0x0 0
W 8 474.444096 5 0x50540cb8 0x0 0x0 0
W 8 474.444097 5 0x50540cc0 0x0 0x0 0
W 8 474.444098 5 0x50540cc8 0x0 0x0 0
W 8 474.444100 5 0x50540cd0 0x0 0x0 0
W 8 474.444101 5 0x50540cd8 0x0 0x0 0
W 8 474.444102 5 0x50540ce0 0x0 0x0 0
W 8 474.444103 5 0x50540ce8 0x0 0x0 0
W 8 474.444104 5 0x50540cf0 0x0 0x0 0
W 8 474.444105 5 0x50540cf8 0x0 0x0 0
W 8 474.444106 5 0x50540d00 0x0 0x0 0
W 8 474.444107 5 0x50540d08 0x0 0x0 0
W 8 474.444108 5 0x50540d10 0x0 0x0 0
W 8 474.444109 5 0x50540d18 0x0 0x0 0
W 8 474.444110 5 0x50540d20 0x0 0x0 0
W 8 474.444111 5 0x50540d28 0x0 0x0 0
W 8 474.444113 5 0x50540d30 0x0 0x0 0
W 8 474.444114 5 0x50540d38 0x0 0x0 0
W 8 474.444115 5 0x50540d40 0x0 0x0 0
W 8 474.444116 5 0x50540d48 0x0 0x0 0
W 8 474.444117 5 0x50540d50 0x0 0x0 0
W 8 474.444118 5 0x50540d58 0x0 0x0 0
W 8 474.444119 5 0x50540d60 0x0 0x0 0
W 8 474.444120 5 0x50540d68 0x0 0x0 0
W 8 474.444121 5 0x50540d70 0x0 0x0 0
W 8 474.444122 5 0x50540d78 0x0 0x0 0
W 8 474.444123 5 0x50540d80 0x0 0x0 0
W 8 474.444124 5 0x50540d88 0x0 0x0 0
W 8 474.444126 5 0x50540d90 0x0 0x0 0
W 8 474.444127 5 0x50540d98 0x0 0x0 0
W 8 474.444128 5 0x50540da0 0x0 0x0 0
W 8 474.444129 5 0x50540da8 0x0 0x0 0
W 8 474.444130 5 0x50540db0 0x0 0x0 0
W 8 474.444131 5 0x50540db8 0x0 0x0 0
W 8 474.444132 5 0x50540dc0 0x0 0x0 0
W 8 474.444133 5 0x50540dc8 0x0 0x0 0
W 8 474.444134 5 0x50540dd0 0x0 0x0 0
W 8 474.444135 5 0x50540dd8 0x0 0x0 0
W 8 474.444136 5 0x50540de0 0x0 0x0 0
W 8 474.444138 5 0x50540de8 0x0 0x0 0
W 8 474.444139 5 0x50540df0 0x0 0x0 0
W 8 474.444140 5 0x50540df8 0x0 0x0 0
W 8 474.444141 5 0x50540e00 0x0 0x0 0
W 8 474.444142 5 0x50540e08 0x0 0x0 0
W 8 474.444143 5 0x50540e10 0x0 0x0 0
W 8 474.444144 5 0x50540e18 0x0 0x0 0
W 8 474.444145 5 0x50540e20 0x0 0x0 0
W 8 474.444146 5 0x50540e28 0x0 0x0 0
W 8 474.444147 5 0x50540e30 0x0 0x0 0
W 8 474.444148 5 0x50540e38 0x0 0x0 0
W 8 474.444150 5 0x50540e40 0x0 0x0 0
W 8 474.444151 5 0x50540e48 0x0 0x0 0
W 8 474.444152 5 0x50540e50 0x0 0x0 0
W 8 474.444153 5 0x50540e58 0x0 0x0 0
W 8 474.444154 5 0x50540e60 0x0 0x0 0
W 8 474.444155 5 0x50540e68 0x0 0x0 0
W 8 474.444156 5 0x50540e70 0x0 0x0 0
W 8 474.444157 5 0x50540e78 0x0 0x0 0
W 8 474.444158 5 0x50540e80 0x0 0x0 0
W 8 474.444159 5 0x50540e88 0x0 0x0 0
W 8 474.444160 5 0x50540e90 0x0 0x0 0
W 8 474.444161 5 0x50540e98 0x0 0x0 0
W 8 474.444163 5 0x50540ea0 0x0 0x0 0
W 8 474.444164 5 0x50540ea8 0x0 0x0 0
W 8 474.444165 5 0x50540eb0 0x0 0x0 0
W 8 474.444166 5 0x50540eb8 0x0 0x0 0
W 8 474.444167 5 0x50540ec0 0x0 0x0 0
W 8 474.444168 5 0x50540ec8 0x0 0x0 0
W 8 474.444169 5 0x50540ed0 0x0 0x0 0
W 8 474.444170 5 0x50540ed8 0x0 0x0 0
W 8 474.444171 5 0x50540ee0 0x0 0x0 0
W 8 474.444172 5 0x50540ee8 0x0 0x0 0
W 8 474.444173 5 0x50540ef0 0x0 0x0 0
W 8 474.444174 5 0x50540ef8 0x0 0x0 0
W 8 474.444175 5 0x50540f00 0x0 0x0 0
W 8 474.444176 5 0x50540f08 0x0 0x0 0
W 8 474.444177 5 0x50540f10 0x0 0x0 0
W 8 474.444179 5 0x50540f18 0x0 0x0 0
W 8 474.444180 5 0x50540f20 0x0 0x0 0
W 8 474.444181 5 0x50540f28 0x0 0x0 0
W 8 474.444182 5 0x50540f30 0x0 0x0 0
W 8 474.444183 5 0x50540f38 0x0 0x0 0
W 8 474.444184 5 0x50540f40 0x0 0x0 0
W 8 474.444185 5 0x50540f48 0x0 0x0 0
W 8 474.444186 5 0x50540f50 0x0 0x0 0
W 8 474.444187 5 0x50540f58 0x0 0x0 0
W 8 474.444188 5 0x50540f60 0x0 0x0 0
W 8 474.444189 5 0x50540f68 0x0 0x0 0
W 8 474.444190 5 0x50540f70 0x0 0x0 0
W 8 474.444192 5 0x50540f78 0x0 0x0 0
W 8 474.444193 5 0x50540f80 0x0 0x0 0
W 8 474.444194 5 0x50540f88 0x0 0x0 0
W 8 474.444195 5 0x50540f90 0x0 0x0 0
W 8 474.444196 5 0x50540f98 0x0 0x0 0
W 8 474.444197 5 0x50540fa0 0x0 0x0 0
W 8 474.444198 5 0x50540fa8 0x0 0x0 0
W 8 474.444199 5 0x50540fb0 0x0 0x0 0
W 8 474.444200 5 0x50540fb8 0x0 0x0 0
W 8 474.444201 5 0x50540fc0 0x0 0x0 0
W 8 474.444202 5 0x50540fc8 0x0 0x0 0
W 8 474.444203 5 0x50540fd0 0x0 0x0 0
W 8 474.444204 5 0x50540fd8 0x0 0x0 0
W 8 474.444205 5 0x50540fe0 0x0 0x0 0
W 8 474.444206 5 0x50540fe8 0x0 0x0 0
W 8 474.444208 5 0x50540ff0 0x0 0x0 0
W 8 474.444209 5 0x50540ff8 0x0 0x0 0
W 4 474.444532 5 0x50540400 0x1e10000d 0x0 0
W 4 474.444534 5 0x50540404 0x0 0x0 0
W 4 474.444535 5 0x50540408 0x1e10010d 0x0 0
W 4 474.444536 5 0x5054040c 0x0 0x0 0
W 4 474.444537 5 0x50540410 0x1e10020d 0x0 0
W 4 474.444538 5 0x50540414 0x0 0x0 0
W 4 474.444540 5 0x50540418 0x1e10030d 0x0 0
W 4 474.444541 5 0x5054041c 0x0 0x0 0
W 4 474.444542 5 0x50540420 0x1e10040d 0x0 0
W 4 474.444543 5 0x50540424 0x0 0x0 0
W 4 474.444544 5 0x50540428 0x1e10050d 0x0 0
W 4 474.444545 5 0x5054042c 0x0 0x0 0
W 4 474.444546 5 0x50540430 0x1e10060d 0x0 0
W 4 474.444547 5 0x50540434 0x0 0x0 0
W 4 474.444548 5 0x50540438 0x1e10070d 0x0 0
W 4 474.444549 5 0x5054043c 0x0 0x0 0
W 4 474.444550 5 0x50540440 0x1e10080d 0x0 0
W 4 474.444551 5 0x50540444 0x0 0x0 0
W 4 474.444552 5 0x50540448 0x1e10090d 0x0 0
W 4 474.444553 5 0x5054044c 0x0 0x0 0
W 4 474.444554 5 0x50540450 0x1e100a0d 0x0 0
W 4 474.444555 5 0x50540454 0x0 0x0 0
W 4 474.444557 5 0x50540458 0x1e100b0d 0x0 0
W 4 474.444558 5 0x5054045c 0x0 0x0 0
W 4 474.444559 5 0x50540460 0x1e100c0d 0x0 0
W 4 474.444560 5 0x50540464 0x0 0x0 0
W 4 474.444561 5 0x50540468 0x1e100d0d 0x0 0
W 4 474.444562 5 0x5054046c 0x0 0x0 0
W 4 474.444563 5 0x50540470 0x1e100e0d 0x0 0
W 4 474.444564 5 0x50540474 0x0 0x0 0
W 4 474.444565 5 0x50540478 0x1e100f0d 0x0 0
W 4 474.444566 5 0x5054047c 0x0 0x0 0
W 4 474.444567 5 0x50540480 0x1e10100d 0x0 0
W 4 474.444569 5 0x50540484 0x0 0x0 0
W 4 474.444570 5 0x50540488 0x1e10110d 0x0 0
W 4 474.444571 5 0x5054048c 0x0 0x0 0
W 4 474.444572 5 0x50540490 0x1e10120d 0x0 0
W 4 474.444573 5 0x50540494 0x0 0x0 0
W 4 474.444574 5 0x50540498 0x1e10130d 0x0 0
W 4 474.444575 5 0x5054049c 0x0 0x0 0
W 4 474.444576 5 0x505404a0 0x1e10140d 0x0 0
W 4 474.444577 5 0x505404a4 0x0 0x0 0
W 4 474.444579 5 0x505404a8 0x1e10150d 0x0 0
W 4 474.444580 5 0x505404ac 0x0 0x0 0
W 4 474.444581 5 0x505404b0 0x1e10160d 0x0 0
W 4 474.444582 5 0x505404b4 0x0 0x0 0
W 4 474.444583 5 0x505404b8 0x1e10170d 0x0 0
W 4 474.444584 5 0x505404bc 0x0 0x0 0
W 4 474.444585 5 0x505404c0 0x1e10180d 0x0 0
W 4 474.444586 5 0x505404c4 0x0 0x0 0
W 4 474.444587 5 0x505404c8 0x1e10190d 0x0 0
W 4 474.444588 5 0x505404cc 0x0 0x0 0
W 4 474.444589 5 0x505404d0 0x1e101a0d 0x0 0
W 4 474.444590 5 0x505404d4 0x0 0x0 0
W 4 474.444591 5 0x505404d8 0x1e101b0d 0x0 0
W 4 474.444592 5 0x505404dc 0x0 0x0 0
W 4 474.444594 5 0x505404e0 0x1e101c0d 0x0 0
W 4 474.444595 5 0x505404e4 0x0 0x0 0
W 4 474.444596 5 0x505404e8 0x1e101d0d 0x0 0
W 4 474.444597 5 0x505404ec 0x0 0x0 0
W 4 474.444598 5 0x505404f0 0x1e101e0d 0x0 0
W 4 474.444599 5 0x505404f4 0x0 0x0 0
W 4 474.444600 5 0x505404f8 0x1e101f0d 0x0 0
W 4 474.444601 5 0x505404fc 0x0 0x0 0
W 4 474.444602 5 0x50540500 0x1e10200d 0x0 0
W 4 474.444603 5 0x50540504 0x0 0x0 0
W 4 474.444604 5 0x50540508 0x1e10210d 0x0 0
W 4 474.444605 5 0x5054050c 0x0 0x0 0
W 4 474.444606 5 0x50540510 0x1e10220d 0x0 0
W 4 474.444607 5 0x50540514 0x0 0x0 0
W 4 474.444608 5 0x50540518 0x1e10230d 0x0 0
W 4 474.444609 5 0x5054051c 0x0 0x0 0
W 4 474.444610 5 0x50540520 0x1e10240d 0x0 0
W 4 474.444611 5 0x50540524 0x0 0x0 0
W 4 474.444613 5 0x50540528 0x1e10250d 0x0 0
W 4 474.444614 5 0x5054052c 0x0 0x0 0
W 4 474.444615 5 0x50540530 0x1e10260d 0x0 0
W 4 474.444616 5 0x50540534 0x0 0x0 0
W 4 474.444617 5 0x50540538 0x1e10270d 0x0 0
W 4 474.444618 5 0x5054053c 0x0 0x0 0
W 4 474.444619 5 0x50540540 0x1e10280d 0x0 0
W 4 474.444620 5 0x50540544 0x0 0x0 0
W 4 474.444621 5 0x50540548 0x1e10290d 0x0 0
W 4 474.444622 5 0x5054054c 0x0 0x0 0
W 4 474.444623 5 0x50540550 0x1e102a0d 0x0 0
W 4 474.444624 5 0x50540554 0x0 0x0 0
W 4 474.444625 5 0x50540558 0x1e102b0d 0x0 0
W 4 474.444626 5 0x5054055c 0x0 0x0 0
W 4 474.444628 5 0x50540560 0x1e102c0d 0x0 0
W 4 474.444629 5 0x50540564 0x0 0x0 0
W 4 474.444630 5 0x50540568 0x1e102d0d 0x0 0
W 4 474.444631 5 0x5054056c 0x0 0x0 0
W 4 474.444632 5 0x50540570 0x1e102e0d 0x0 0
W 4 474.444633 5 0x50540574 0x0 0x0 0
W 4 474.444634 5 0x50540578 0x1e102f0d 0x0 0
W 4 474.444635 5 0x5054057c 0x0 0x0 0
W 4 474.444636 5 0x50540580 0x1e10300d 0x0 0
W 4 474.444637 5 0x50540584 0x0 0x0 0
W 4 474.444638 5 0x50540588 0x1e10310d 0x0 0
W 4 474.444639 5 0x5054058c 0x0 0x0 0
W 4 474.444640 5 0x50540590 0x1e10320d 0x0 0
W 4 474.444641 5 0x50540594 0x0 0x0 0
W 4 474.444642 5 0x50540598 0x1e10330d 0x0 0
W 4 474.444643 5 0x5054059c 0x0 0x0 0
W 4 474.444644 5 0x505405a0 0x1e10340d 0x0 0
W 4 474.444645 5 0x505405a4 0x0 0x0 0
W 4 474.444647 5 0x505405a8 0x1e10350d 0x0 0
W 4 474.444648 5 0x505405ac 0x0 0x0 0
W 4 474.444649 5 0x505405b0 0x1e10360d 0x0 0
W 4 474.444650 5 0x505405b4 0x0 0x0 0
W 4 474.444651 5 0x505405b8 0x1e10370d 0x0 0
W 4 474.444652 5 0x505405bc 0x0 0x0 0
W 4 474.444653 5 0x505405c0 0x1e10380d 0x0 0
W 4 474.444654 5 0x505405c4 0x0 0x0 0
W 4 474.444655 5 0x505405c8 0x1e10390d 0x0 0
W 4 474.444656 5 0x505405cc 0x0 0x0 0
W 4 474.444657 5 0x505405d0 0x1e103a0d 0x0 0
W 4 474.444658 5 0x505405d4 0x0 0x0 0
W 4 474.444659 5 0x505405d8 0x1e103b0d 0x0 0
W 4 474.444660 5 0x505405dc 0x0 0x0 0
W 4 474.444661 5 0x505405e0 0x1e103c0d 0x0 0
W 4 474.444663 5 0x505405e4 0x0 0x0 0
W 4 474.444664 5 0x505405e8 0x1e103d0d 0x0 0
W 4 474.444665 5 0x505405ec 0x0 0x0 0
W 4 474.444666 5 0x505405f0 0x1e103e0d 0x0 0
W 4 474.444667 5 0x505405f4 0x0 0x0 0
W 4 474.444668 5 0x505405f8 0x1e103f0d 0x0 0
W 4 474.444669 5 0x505405fc 0x0 0x0 0
W 4 474.444670 5 0x50540600 0x1e10400d 0x0 0
W 4 474.444671 5 0x50540604 0x0 0x0 0
W 4 474.444673 5 0x50540608 0x1e10410d 0x0 0
W 4 474.444674 5 0x5054060c 0x0 0x0 0
W 4 474.444675 5 0x50540610 0x1e10420d 0x0 0
W 4 474.444676 5 0x50540614 0x0 0x0 0
W 4 474.444677 5 0x50540618 0x1e10430d 0x0 0
W 4 474.444678 5 0x5054061c 0x0 0x0 0
W 4 474.444679 5 0x50540620 0x1e10440d 0x0 0
W 4 474.444680 5 0x50540624 0x0 0x0 0
W 4 474.444681 5 0x50540628 0x1e10450d 0x0 0
W 4 474.444682 5 0x5054062c 0x0 0x0 0
W 4 474.444684 5 0x50540630 0x1e10460d 0x0 0
W 4 474.444685 5 0x50540634 0x0 0x0 0
W 4 474.444686 5 0x50540638 0x1e10470d 0x0 0
W 4 474.444687 5 0x5054063c 0x0 0x0 0
W 4 474.444688 5 0x50540640 0x1e10480d 0x0 0
W 4 474.444689 5 0x50540644 0x0 0x0 0
W 4 474.444690 5 0x50540648 0x1e10490d 0x0 0
W 4 474.444691 5 0x5054064c 0x0 0x0 0
W 4 474.444692 5 0x50540650 0x1e104a0d 0x0 0
W 4 474.444693 5 0x50540654 0x0 0x0 0
W 4 474.444694 5 0x50540658 0x1e104b0d 0x0 0
W 4 474.444695 5 0x5054065c 0x0 0x0 0
W 4 474.444697 5 0x50540660 0x1e104c0d 0x0 0
W 4 474.444698 5 0x50540664 0x0 0x0 0
W 4 474.444699 5 0x50540668 0x1e104d0d 0x0 0
W 4 474.444700 5 0x5054066c 0x0 0x0 0
W 4 474.444701 5 0x50540670 0x1e104e0d 0x0 0
W 4 474.444702 5 0x50540674 0x0 0x0 0
W 4 474.444703 5 0x50540678 0x1e104f0d 0x0 0
W 4 474.444704 5 0x5054067c 0x0 0x0 0
W 4 474.444705 5 0x50540680 0x1e10500d 0x0 0
W 4 474.444706 5 0x50540684 0x0 0x0 0
W 4 474.444707 5 0x50540688 0x1e10510d 0x0 0
W 4 474.444708 5 0x5054068c 0x0 0x0 0
W 4 474.444709 5 0x50540690 0x1e10520d 0x0 0
W 4 474.444710 5 0x50540694 0x0 0x0 0
W 4 474.444712 5 0x50540698 0x1e10530d 0x0 0
W 4 474.444713 5 0x5054069c 0x0 0x0 0
W 4 474.444714 5 0x505406a0 0x1e10540d 0x0 0
W 4 474.444715 5 0x505406a4 0x0 0x0 0
W 4 474.444716 5 0x505406a8 0x1e10550d 0x0 0
W 4 474.444717 5 0x505406ac 0x0 0x0 0
W 4 474.444718 5 0x505406b0 0x1e10560d 0x0 0
W 4 474.444719 5 0x505406b4 0x0 0x0 0
W 4 474.444720 5 0x505406b8 0x1e10570d 0x0 0
W 4 474.444721 5 0x505406bc 0x0 0x0 0
W 4 474.444722 5 0x505406c0 0x1e10580d 0x0 0
W 4 474.444723 5 0x505406c4 0x0 0x0 0
W 4 474.444724 5 0x505406c8 0x1e10590d 0x0 0
W 4 474.444725 5 0x505406cc 0x0 0x0 0
W 4 474.444727 5 0x505406d0 0x1e105a0d 0x0 0
W 4 474.444728 5 0x505406d4 0x0 0x0 0
W 4 474.444729 5 0x505406d8 0x1e105b0d 0x0 0
W 4 474.444730 5 0x505406dc 0x0 0x0 0
W 4 474.444731 5 0x505406e0 0x1e105c0d 0x0 0
W 4 474.444732 5 0x505406e4 0x0 0x0 0
W 4 474.444733 5 0x505406e8 0x1e105d0d 0x0 0
W 4 474.444734 5 0x505406ec 0x0 0x0 0
W 4 474.444735 5 0x505406f0 0x1e105e0d 0x0 0
W 4 474.444736 5 0x505406f4 0x0 0x0 0
W 4 474.444737 5 0x505406f8 0x1e105f0d 0x0 0
W 4 474.444738 5 0x505406fc 0x0 0x0 0
W 4 474.444739 5 0x50540700 0x1e10600d 0x0 0
W 4 474.444740 5 0x50540704 0x0 0x0 0
W 4 474.444741 5 0x50540708 0x1e10610d 0x0 0
W 4 474.444742 5 0x5054070c 0x0 0x0 0
W 4 474.444743 5 0x50540710 0x1e10620d 0x0 0
W 4 474.444744 5 0x50540714 0x0 0x0 0
W 4 474.444745 5 0x50540718 0x1e10630d 0x0 0
W 4 474.444747 5 0x5054071c 0x0 0x0 0
W 4 474.444748 5 0x50540720 0x1e10640d 0x0 0
W 4 474.444749 5 0x50540724 0x0 0x0 0
W 4 474.444750 5 0x50540728 0x1e10650d 0x0 0
W 4 474.444751 5 0x5054072c 0x0 0x0 0
W 4 474.444752 5 0x50540730 0x1e10660d 0x0 0
W 4 474.444753 5 0x50540734 0x0 0x0 0
W 4 474.444754 5 0x50540738 0x1e10670d 0x0 0
W 4 474.444755 5 0x5054073c 0x0 0x0 0
W 4 474.444756 5 0x50540740 0x1e10680d 0x0 0
W 4 474.444758 5 0x50540744 0x0 0x0 0
W 4 474.444759 5 0x50540748 0x1e10690d 0x0 0
W 4 474.444760 5 0x5054074c 0x0 0x0 0
W 4 474.444761 5 0x50540750 0x1e106a0d 0x0 0
W 4 474.444762 5 0x50540754 0x0 0x0 0
W 4 474.444763 5 0x50540758 0x1e106b0d 0x0 0
W 4 474.444764 5 0x5054075c 0x0 0x0 0
W 4 474.444765 5 0x50540760 0x1e106c0d 0x0 0
W 4 474.444766 5 0x50540764 0x0 0x0 0
W 4 474.444767 5 0x50540768 0x1e106d0d 0x0 0
W 4 474.444768 5 0x5054076c 0x0 0x0 0
W 4 474.444769 5 0x50540770 0x1e106e0d 0x0 0
W 4 474.444770 5 0x50540774 0x0 0x0 0
W 4 474.444772 5 0x50540778 0x1e106f0d 0x0 0
W 4 474.444773 5 0x5054077c 0x0 0x0 0
W 4 474.444774 5 0x50540780 0x1e10700d 0x0 0
W 4 474.444775 5 0x50540784 0x0 0x0 0
W 4 474.444776 5 0x50540788 0x1e10710d 0x0 0
W 4 474.444777 5 0x5054078c 0x0 0x0 0
W 4 474.444778 5 0x50540790 0x1e10720d 0x0 0
W 4 474.444779 5 0x50540794 0x0 0x0 0
W 4 474.444780 5 0x50540798 0x1e10730d 0x0 0
W 4 474.444781 5 0x5054079c 0x0 0x0 0
W 4 474.444782 5 0x505407a0 0x1e10740d 0x0 0
W 4 474.444783 5 0x505407a4 0x0 0x0 0
W 4 474.444784 5 0x505407a8 0x1e10750d 0x0 0
W 4 474.444785 5 0x505407ac 0x0 0x0 0
W 4 474.444787 5 0x505407b0 0x1e10760d 0x0 0
W 4 474.444788 5 0x505407b4 0x0 0x0 0
W 4 474.444789 5 0x505407b8 0x1e10770d 0x0 0
W 4 474.444790 5 0x505407bc 0x0 0x0 0
W 4 474.444791 5 0x505407c0 0x1e10780d 0x0 0
W 4 474.444792 5 0x505407c4 0x0 0x0 0
W 4 474.444793 5 0x505407c8 0x1e10790d 0x0 0
W 4 474.444794 5 0x505407cc 0x0 0x0 0
W 4 474.444795 5 0x505407d0 0x1e107a0d 0x0 0
W 4 474.444796 5 0x505407d4 0x0 0x0 0
W 4 474.444797 5 0x505407d8 0x1e107b0d 0x0 0
W 4 474.444798 5 0x505407dc 0x0 0x0 0
W 4 474.444799 5 0x505407e0 0x1e107c0d 0x0 0
W 4 474.444800 5 0x505407e4 0x0 0x0 0
W 4 474.444801 5 0x505407e8 0x1e107d0d 0x0 0
W 4 474.444802 5 0x505407ec 0x0 0x0 0
W 4 474.444803 5 0x505407f0 0x1e107e0d 0x0 0
W 4 474.444804 5 0x505407f4 0x0 0x0 0
W 4 474.444805 5 0x505407f8 0x1e107f0d 0x0 0
W 4 474.444806 5 0x505407fc 0x0 0x0 0
W 4 474.444808 5 0x50540800 0x1e10800d 0x0 0
W 4 474.444809 5 0x50540804 0x0 0x0 0
W 4 474.444810 5 0x50540808 0x1e10810d 0x0 0
W 4 474.444811 5 0x5054080c 0x0 0x0 0
W 4 474.444812 5 0x50540810 0x1e10820d 0x0 0
W 4 474.444813 5 0x50540814 0x0 0x0 0
W 4 474.444814 5 0x50540818 0x1e10830d 0x0 0
W 4 474.444815 5 0x5054081c 0x0 0x0 0
W 4 474.444816 5 0x50540820 0x1e10840d 0x0 0
W 4 474.444817 5 0x50540824 0x0 0x0 0
W 4 474.444818 5 0x50540828 0x1e10850d 0x0 0
W 4 474.444819 5 0x5054082c 0x0 0x0 0
W 4 474.444820 5 0x50540830 0x1e10860d 0x0 0
W 4 474.444821 5 0x50540834 0x0 0x0 0
W 4 474.444822 5 0x50540838 0x1e10870d 0x0 0
W 4 474.444823 5 0x5054083c 0x0 0x0 0
W 4 474.444825 5 0x50540840 0x1e10880d 0x0 0
W 4 474.444826 5 0x50540844 0x0 0x0 0
W 4 474.444827 5 0x50540848 0x1e10890d 0x0 0
W 4 474.444828 5 0x5054084c 0x0 0x0 0
W 4 474.444829 5 0x50540850 0x1e108a0d 0x0 0
W 4 474.444830 5 0x50540854 0x0 0x0 0
W 4 474.444831 5 0x50540858 0x1e108b0d 0x0 0
W 4 474.444832 5 0x5054085c 0x0 0x0 0
W 4 474.444833 5 0x50540860 0x1e108c0d 0x0 0
W 4 474.444834 5 0x50540864 0x0 0x0 0
W 4 474.444835 5 0x50540868 0x1e108d0d 0x0 0
W 4 474.444836 5 0x5054086c 0x0 0x0 0
W 4 474.444837 5 0x50540870 0x1e108e0d 0x0 0
W 4 474.444839 5 0x50540874 0x0 0x0 0
W 4 474.444840 5 0x50540878 0x1e108f0d 0x0 0
W 4 474.444841 5 0x5054087c 0x0 0x0 0
W 4 474.444842 5 0x50540880 0x1e10900d 0x0 0
W 4 474.444843 5 0x50540884 0x0 0x0 0
W 4 474.444844 5 0x50540888 0x1e10910d 0x0 0
W 4 474.444845 5 0x5054088c 0x0 0x0 0
W 4 474.444846 5 0x50540890 0x1e10920d 0x0 0
W 4 474.444847 5 0x50540894 0x0 0x0 0
W 4 474.444848 5 0x50540898 0x1e10930d 0x0 0
W 4 474.444849 5 0x5054089c 0x0 0x0 0
W 4 474.444850 5 0x505408a0 0x1e10940d 0x0 0
W 4 474.444851 5 0x505408a4 0x0 0x0 0
W 4 474.444852 5 0x505408a8 0x1e10950d 0x0 0
W 4 474.444853 5 0x505408ac 0x0 0x0 0
W 4 474.444854 5 0x505408b0 0x1e10960d 0x0 0
W 4 474.444856 5 0x505408b4 0x0 0x0 0
W 4 474.444857 5 0x505408b8 0x1e10970d 0x0 0
W 4 474.444858 5 0x505408bc 0x0 0x0 0
W 4 474.444859 5 0x505408c0 0x1e10980d 0x0 0
W 4 474.444860 5 0x505408c4 0x0 0x0 0
W 4 474.444861 5 0x505408c8 0x1e10990d 0x0 0
W 4 474.444862 5 0x505408cc 0x0 0x0 0
W 4 474.444863 5 0x505408d0 0x1e109a0d 0x0 0
W 4 474.444864 5 0x505408d4 0x0 0x0 0
W 4 474.444865 5 0x505408d8 0x1e109b0d 0x0 0
W 4 474.444866 5 0x505408dc 0x0 0x0 0
W 4 474.444867 5 0x505408e0 0x1e109c0d 0x0 0
W 4 474.444869 5 0x505408e4 0x0 0x0 0
W 4 474.444870 5 0x505408e8 0x1e109d0d 0x0 0
W 4 474.444871 5 0x505408ec 0x0 0x0 0
W 4 474.444872 5 0x505408f0 0x1e109e0d 0x0 0
W 4 474.444874 5 0x505408f4 0x0 0x0 0
W 4 474.444875 5 0x505408f8 0x1e109f0d 0x0 0
W 4 474.444876 5 0x505408fc 0x0 0x0 0
W 4 474.444878 5 0x50540900 0x1e10a00d 0x0 0
W 4 474.444879 5 0x50540904 0x0 0x0 0
W 4 474.444880 5 0x50540908 0x1e10a10d 0x0 0
W 4 474.444881 5 0x5054090c 0x0 0x0 0
W 4 474.444882 5 0x50540910 0x1e10a20d 0x0 0
W 4 474.444883 5 0x50540914 0x0 0x0 0
W 4 474.444884 5 0x50540918 0x1e10a30d 0x0 0
W 4 474.444885 5 0x5054091c 0x0 0x0 0
W 4 474.444886 5 0x50540920 0x1e10a40d 0x0 0
W 4 474.444887 5 0x50540924 0x0 0x0 0
W 4 474.444888 5 0x50540928 0x1e10a50d 0x0 0
W 4 474.444889 5 0x5054092c 0x0 0x0 0
W 4 474.444890 5 0x50540930 0x1e10a60d 0x0 0
W 4 474.444891 5 0x50540934 0x0 0x0 0
W 4 474.444893 5 0x50540938 0x1e10a70d 0x0 0
W 4 474.444894 5 0x5054093c 0x0 0x0 0
W 4 474.444895 5 0x50540940 0x1e10a80d 0x0 0
W 4 474.444896 5 0x50540944 0x0 0x0 0
W 4 474.444897 5 0x50540948 0x1e10a90d 0x0 0
W 4 474.444898 5 0x5054094c 0x0 0x0 0
W 4 474.444899 5 0x50540950 0x1e10aa0d 0x0 0
W 4 474.444900 5 0x50540954 0x0 0x0 0
W 4 474.444901 5 0x50540958 0x1e10ab0d 0x0 0
W 4 474.444902 5 0x5054095c 0x0 0x0 0
W 4 474.444903 5 0x50540960 0x1e10ac0d 0x0 0
W 4 474.444904 5 0x50540964 0x0 0x0 0
W 4 474.444905 5 0x50540968 0x1e10ad0d 0x0 0
W 4 474.444906 5 0x5054096c 0x0 0x0 0
W 4 474.444907 5 0x50540970 0x1e10ae0d 0x0 0
W 4 474.444908 5 0x50540974 0x0 0x0 0
W 4 474.444910 5 0x50540978 0x1e10af0d 0x0 0
W 4 474.444911 5 0x5054097c 0x0 0x0 0
W 4 474.444912 5 0x50540980 0x1e10b00d 0x0 0
W 4 474.444913 5 0x50540984 0x0 0x0 0
W 4 474.444914 5 0x50540988 0x1e10b10d 0x0 0
W 4 474.444915 5 0x5054098c 0x0 0x0 0
W 4 474.444916 5 0x50540990 0x1e10b20d 0x0 0
W 4 474.444917 5 0x50540994 0x0 0x0 0
W 4 474.444918 5 0x50540998 0x1e10b30d 0x0 0
W 4 474.444919 5 0x5054099c 0x0 0x0 0
W 4 474.444920 5 0x505409a0 0x1e10b40d 0x0 0
W 4 474.444921 5 0x505409a4 0x0 0x0 0
W 4 474.444922 5 0x505409a8 0x1e10b50d 0x0 0
W 4 474.444923 5 0x505409ac 0x0 0x0 0
W 4 474.444924 5 0x505409b0 0x1e10b60d 0x0 0
W 4 474.444925 5 0x505409b4 0x0 0x0 0
W 4 474.444926 5 0x505409b8 0x1e10b70d 0x0 0
W 4 474.444927 5 0x505409bc 0x0 0x0 0
W 4 474.444928 5 0x505409c0 0x1e10b80d 0x0 0
W 4 474.444929 5 0x505409c4 0x0 0x0 0
W 4 474.444930 5 0x505409c8 0x1e10b90d 0x0 0
W 4 474.444931 5 0x505409cc 0x0 0x0 0
W 4 474.444932 5 0x505409d0 0x1e10ba0d 0x0 0
W 4 474.444934 5 0x505409d4 0x0 0x0 0
W 4 474.444935 5 0x505409d8 0x1e10bb0d 0x0 0
W 4 474.444936 5 0x505409dc 0x0 0x0 0
W 4 474.444937 5 0x505409e0 0x1e10bc0d 0x0 0
W 4 474.444938 5 0x505409e4 0x0 0x0 0
W 4 474.444939 5 0x505409e8 0x1e10bd0d 0x0 0
W 4 474.444940 5 0x505409ec 0x0 0x0 0
W 4 474.444941 5 0x505409f0 0x1e10be0d 0x0 0
W 4 474.444942 5 0x505409f4 0x0 0x0 0
W 4 474.444943 5 0x505409f8 0x1e10bf0d 0x0 0
W 4 474.444944 5 0x505409fc 0x0 0x0 0
W 4 474.444945 5 0x50540a00 0x1e10c00d 0x0 0
W 4 474.444946 5 0x50540a04 0x0 0x0 0
W 4 474.444947 5 0x50540a08 0x1e10c10d 0x0 0
W 4 474.444948 5 0x50540a0c 0x0 0x0 0
W 4 474.444949 5 0x50540a10 0x1e10c20d 0x0 0
W 4 474.444950 5 0x50540a14 0x0 0x0 0
W 4 474.444951 5 0x50540a18 0x1e10c30d 0x0 0
W 4 474.444953 5 0x50540a1c 0x0 0x0 0
W 4 474.444954 5 0x50540a20 0x1e10c40d 0x0 0
W 4 474.444955 5 0x50540a24 0x0 0x0 0
W 4 474.444956 5 0x50540a28 0x1e10c50d 0x0 0
W 4 474.444957 5 0x50540a2c 0x0 0x0 0
W 4 474.444958 5 0x50540a30 0x1e10c60d 0x0 0
W 4 474.444959 5 0x50540a34 0x0 0x0 0
W 4 474.444960 5 0x50540a38 0x1e10c70d 0x0 0
W 4 474.444961 5 0x50540a3c 0x0 0x0 0
W 4 474.444962 5 0x50540a40 0x1e10c80d 0x0 0
W 4 474.444963 5 0x50540a44 0x0 0x0 0
W 4 474.444964 5 0x50540a48 0x1e10c90d 0x0 0
W 4 474.444965 5 0x50540a4c 0x0 0x0 0
W 4 474.444966 5 0x50540a50 0x1e10ca0d 0x0 0
W 4 474.444967 5 0x50540a54 0x0 0x0 0
W 4 474.444969 5 0x50540a58 0x1e10cb0d 0x0 0
W 4 474.444970 5 0x50540a5c 0x0 0x0 0
W 4 474.444971 5 0x50540a60 0x1e10cc0d 0x0 0
W 4 474.444972 5 0x50540a64 0x0 0x0 0
W 4 474.444973 5 0x50540a68 0x1e10cd0d 0x0 0
W 4 474.444974 5 0x50540a6c 0x0 0x0 0
W 4 474.444975 5 0x50540a70 0x1e10ce0d 0x0 0
W 4 474.444976 5 0x50540a74 0x0 0x0 0
W 4 474.444977 5 0x50540a78 0x1e10cf0d 0x0 0
W 4 474.444978 5 0x50540a7c 0x0 0x0 0
W 4 474.444979 5 0x50540a80 0x1e10d00d 0x0 0
W 4 474.444980 5 0x50540a84 0x0 0x0 0
W 4 474.444981 5 0x50540a88 0x1e10d10d 0x0 0
W 4 474.444982 5 0x50540a8c 0x0 0x0 0
W 4 474.444983 5 0x50540a90 0x1e10d20d 0x0 0
W 4 474.444985 5 0x50540a94 0x0 0x0 0
W 4 474.444986 5 0x50540a98 0x1e10d30d 0x0 0
W 4 474.444987 5 0x50540a9c 0x0 0x0 0
W 4 474.444988 5 0x50540aa0 0x1e10d40d 0x0 0
W 4 474.444989 5 0x50540aa4 0x0 0x0 0
W 4 474.444990 5 0x50540aa8 0x1e10d50d 0x0 0
W 4 474.444991 5 0x50540aac 0x0 0x0 0
W 4 474.444992 5 0x50540ab0 0x1e10d60d 0x0 0
W 4 474.444993 5 0x50540ab4 0x0 0x0 0
W 4 474.444994 5 0x50540ab8 0x1e10d70d 0x0 0
W 4 474.444995 5 0x50540abc 0x0 0x0 0
W 4 474.444996 5 0x50540ac0 0x1e10d80d 0x0 0
W 4 474.444997 5 0x50540ac4 0x0 0x0 0
W 4 474.444998 5 0x50540ac8 0x1e10d90d 0x0 0
W 4 474.444999 5 0x50540acc 0x0 0x0 0
W 4 474.445000 5 0x50540ad0 0x1e10da0d 0x0 0
W 4 474.445001 5 0x50540ad4 0x0 0x0 0
W 4 474.445003 5 0x50540ad8 0x1e10db0d 0x0 0
W 4 474.445004 5 0x50540adc 0x0 0x0 0
W 4 474.445005 5 0x50540ae0 0x1e10dc0d 0x0 0
W 4 474.445006 5 0x50540ae4 0x0 0x0 0
W 4 474.445007 5 0x50540ae8 0x1e10dd0d 0x0 0
W 4 474.445008 5 0x50540aec 0x0 0x0 0
W 4 474.445009 5 0x50540af0 0x1e10de0d 0x0 0
W 4 474.445010 5 0x50540af4 0x0 0x0 0
W 4 474.445011 5 0x50540af8 0x1e10df0d 0x0 0
W 4 474.445012 5 0x50540afc 0x0 0x0 0
W 4 474.445013 5 0x50540b00 0x1e10e00d 0x0 0
W 4 474.445014 5 0x50540b04 0x0 0x0 0
W 4 474.445016 5 0x50540b08 0x1e10e10d 0x0 0
W 4 474.445017 5 0x50540b0c 0x0 0x0 0
W 4 474.445018 5 0x50540b10 0x1e10e20d 0x0 0
W 4 474.445019 5 0x50540b14 0x0 0x0 0
W 4 474.445020 5 0x50540b18 0x1e10e30d 0x0 0
W 4 474.445021 5 0x50540b1c 0x0 0x0 0
W 4 474.445022 5 0x50540b20 0x1e10e40d 0x0 0
W 4 474.445023 5 0x50540b24 0x0 0x0 0
W 4 474.445024 5 0x50540b28 0x1e10e50d 0x0 0
W 4 474.445025 5 0x50540b2c 0x0 0x0 0
W 4 474.445026 5 0x50540b30 0x1e10e60d 0x0 0
W 4 474.445027 5 0x50540b34 0x0 0x0 0
W 4 474.445028 5 0x50540b38 0x1e10e70d 0x0 0
W 4 474.445029 5 0x50540b3c 0x0 0x0 0
W 4 474.445030 5 0x50540b40 0x1e10e80d 0x0 0
W 4 474.445032 5 0x50540b44 0x0 0x0 0
W 4 474.445033 5 0x50540b48 0x1e10e90d 0x0 0
W 4 474.445034 5 0x50540b4c 0x0 0x0 0
W 4 474.445035 5 0x50540b50 0x1e10ea0d 0x0 0
W 4 474.445036 5 0x50540b54 0x0 0x0 0
W 4 474.445037 5 0x50540b58 0x1e10eb0d 0x0 0
W 4 474.445038 5 0x50540b5c 0x0 0x0 0
W 4 474.445039 5 0x50540b60 0x1e10ec0d 0x0 0
W 4 474.445040 5 0x50540b64 0x0 0x0 0
W 4 474.445041 5 0x50540b68 0x1e10ed0d 0x0 0
W 4 474.445042 5 0x50540b6c 0x0 0x0 0
W 4 474.445043 5 0x50540b70 0x1e10ee0d 0x0 0
W 4 474.445044 5 0x50540b74 0x0 0x0 0
W 4 474.445045 5 0x50540b78 0x1e10ef0d 0x0 0
W 4 474.445046 5 0x50540b7c 0x0 0x0 0
W 4 474.445047 5 0x50540b80 0x1e10f00d 0x0 0
W 4 474.445049 5 0x50540b84 0x0 0x0 0
W 4 474.445050 5 0x50540b88 0x1e10f10d 0x0 0
W 4 474.445051 5 0x50540b8c 0x0 0x0 0
W 4 474.445052 5 0x50540b90 0x1e10f20d 0x0 0
W 4 474.445053 5 0x50540b94 0x0 0x0 0
W 4 474.445054 5 0x50540b98 0x1e10f30d 0x0 0
W 4 474.445056 5 0x50540b9c 0x0 0x0 0
W 4 474.445057 5 0x50540ba0 0x1e10f40d 0x0 0
W 4 474.445058 5 0x50540ba4 0x0 0x0 0
W 4 474.445059 5 0x50540ba8 0x1e10f50d 0x0 0
W 4 474.445060 5 0x50540bac 0x0 0x0 0
W 4 474.445061 5 0x50540bb0 0x1e10f60d 0x0 0
W 4 474.445062 5 0x50540bb4 0x0 0x0 0
W 4 474.445063 5 0x50540bb8 0x1e10f70d 0x0 0
W 4 474.445064 5 0x50540bbc 0x0 0x0 0
W 4 474.445065 5 0x50540bc0 0x1e10f80d 0x0 0
W 4 474.445066 5 0x50540bc4 0x0 0x0 0
W 4 474.445067 5 0x50540bc8 0x1e10f90d 0x0 0
W 4 474.445068 5 0x50540bcc 0x0 0x0 0
W 4 474.445069 5 0x50540bd0 0x1e10fa0d 0x0 0
W 4 474.445070 5 0x50540bd4 0x0 0x0 0
W 4 474.445071 5 0x50540bd8 0x1e10fb0d 0x0 0
W 4 474.445072 5 0x50540bdc 0x0 0x0 0
W 4 474.445073 5 0x50540be0 0x1e10fc0d 0x0 0
W 4 474.445074 5 0x50540be4 0x0 0x0 0
W 4 474.445075 5 0x50540be8 0x1e10fd0d 0x0 0
W 4 474.445076 5 0x50540bec 0x0 0x0 0
W 4 474.445077 5 0x50540bf0 0x1e10fe0d 0x0 0
W 4 474.445078 5 0x50540bf4 0x0 0x0 0
W 4 474.445080 5 0x50540bf8 0x1e10ff0d 0x0 0
W 4 474.445081 5 0x50540bfc 0x0 0x0 0
W 4 474.445082 5 0x50540c00 0x1062800d 0x0 0
W 4 474.445083 5 0x50540c04 0x0 0x0 0
W 4 474.445084 5 0x50540c08 0x1062810d 0x0 0
W 4 474.445085 5 0x50540c0c 0x0 0x0 0
W 4 474.445086 5 0x50540c10 0x1062820d 0x0 0
W 4 474.445087 5 0x50540c14 0x0 0x0 0
W 4 474.445088 5 0x50540c18 0x1062830d 0x0 0
W 4 474.445089 5 0x50540c1c 0x0 0x0 0
W 4 474.445090 5 0x50540c20 0x1062840d 0x0 0
W 4 474.445091 5 0x50540c24 0x0 0x0 0
W 4 474.445092 5 0x50540c28 0x1062850d 0x0 0
W 4 474.445093 5 0x50540c2c 0x0 0x0 0
W 4 474.445094 5 0x50540c30 0x1062860d 0x0 0
W 4 474.445095 5 0x50540c34 0x0 0x0 0
W 4 474.445096 5 0x50540c38 0x1062870d 0x0 0
W 4 474.445097 5 0x50540c3c 0x0 0x0 0
W 4 474.445098 5 0x50540c40 0x1062880d 0x0 0
W 4 474.445099 5 0x50540c44 0x0 0x0 0
W 4 474.445101 5 0x50540c48 0x1062890d 0x0 0
W 4 474.445102 5 0x50540c4c 0x0 0x0 0
W 4 474.445103 5 0x50540c50 0x10628a0d 0x0 0
W 4 474.445104 5 0x50540c54 0x0 0x0 0
W 4 474.445105 5 0x50540c58 0x10628b0d 0x0 0
W 4 474.445106 5 0x50540c5c 0x0 0x0 0
W 4 474.445107 5 0x50540c60 0x10628c0d 0x0 0
W 4 474.445108 5 0x50540c64 0x0 0x0 0
W 4 474.445109 5 0x50540c68 0x10628d0d 0x0 0
W 4 474.445110 5 0x50540c6c 0x0 0x0 0
W 4 474.445111 5 0x50540c70 0x10628e0d 0x0 0
W 4 474.445112 5 0x50540c74 0x0 0x0 0
W 4 474.445114 5 0x50540c78 0x10628f0d 0x0 0
W 4 474.445115 5 0x50540c7c 0x0 0x0 0
W 4 474.445116 5 0x50540c80 0x1062900d 0x0 0
W 4 474.445117 5 0x50540c84 0x0 0x0 0
W 4 474.445118 5 0x50540c88 0x1062910d 0x0 0
W 4 474.445119 5 0x50540c8c 0x0 0x0 0
W 4 474.445120 5 0x50540c90 0x1062920d 0x0 0
W 4 474.445121 5 0x50540c94 0x0 0x0 0
W 4 474.445122 5 0x50540c98 0x1062930d 0x0 0
W 4 474.445123 5 0x50540c9c 0x0 0x0 0
W 4 474.445124 5 0x50540ca0 0x1062940d 0x0 0
W 4 474.445125 5 0x50540ca4 0x0 0x0 0
W 4 474.445126 5 0x50540ca8 0x1062950d 0x0 0
W 4 474.445127 5 0x50540cac 0x0 0x0 0
W 4 474.445128 5 0x50540cb0 0x1062960d 0x0 0
W 4 474.445129 5 0x50540cb4 0x0 0x0 0
W 4 474.445130 5 0x50540cb8 0x1062970d 0x0 0
W 4 474.445131 5 0x50540cbc 0x0 0x0 0
W 4 474.445132 5 0x50540cc0 0x1062980d 0x0 0
W 4 474.445133 5 0x50540cc4 0x0 0x0 0
W 4 474.445135 5 0x50540cc8 0x1062990d 0x0 0
W 4 474.445136 5 0x50540ccc 0x0 0x0 0
W 4 474.445137 5 0x50540cd0 0x10629a0d 0x0 0
W 4 474.445138 5 0x50540cd4 0x0 0x0 0
W 4 474.445139 5 0x50540cd8 0x10629b0d 0x0 0
W 4 474.445140 5 0x50540cdc 0x0 0x0 0
W 4 474.445141 5 0x50540ce0 0x10629c0d 0x0 0
W 4 474.445142 5 0x50540ce4 0x0 0x0 0
W 4 474.445143 5 0x50540ce8 0x10629d0d 0x0 0
W 4 474.445144 5 0x50540cec 0x0 0x0 0
W 4 474.445145 5 0x50540cf0 0x10629e0d 0x0 0
W 4 474.445146 5 0x50540cf4 0x0 0x0 0
W 4 474.445148 5 0x50540cf8 0x10629f0d 0x0 0
W 4 474.445149 5 0x50540cfc 0x0 0x0 0
W 4 474.445150 5 0x50540d00 0x1062a00d 0x0 0
W 4 474.445151 5 0x50540d04 0x0 0x0 0
W 4 474.445152 5 0x50540d08 0x1062a10d 0x0 0
W 4 474.445153 5 0x50540d0c 0x0 0x0 0
W 4 474.445154 5 0x50540d10 0x1062a20d 0x0 0
W 4 474.445155 5 0x50540d14 0x0 0x0 0
W 4 474.445156 5 0x50540d18 0x1062a30d 0x0 0
W 4 474.445157 5 0x50540d1c 0x0 0x0 0
W 4 474.445159 5 0x50540d20 0x1062a40d 0x0 0
W 4 474.445160 5 0x50540d24 0x0 0x0 0
W 4 474.445161 5 0x50540d28 0x1062a50d 0x0 0
W 4 474.445162 5 0x50540d2c 0x0 0x0 0
W 4 474.445163 5 0x50540d30 0x1062a60d 0x0 0
W 4 474.445164 5 0x50540d34 0x0 0x0 0
W 4 474.445165 5 0x50540d38 0x1062a70d 0x0 0
W 4 474.445166 5 0x50540d3c 0x0 0x0 0
W 4 474.445167 5 0x50540d40 0x1062a80d 0x0 0
W 4 474.445168 5 0x50540d44 0x0 0x0 0
W 4 474.445169 5 0x50540d48 0x1062a90d 0x0 0
W 4 474.445170 5 0x50540d4c 0x0 0x0 0
W 4 474.445171 5 0x50540d50 0x1062aa0d 0x0 0
W 4 474.445172 5 0x50540d54 0x0 0x0 0
W 4 474.445174 5 0x50540d58 0x1062ab0d 0x0 0
W 4 474.445175 5 0x50540d5c 0x0 0x0 0
W 4 474.445176 5 0x50540d60 0x1062ac0d 0x0 0
W 4 474.445177 5 0x50540d64 0x0 0x0 0
W 4 474.445178 5 0x50540d68 0x1062ad0d 0x0 0
W 4 474.445179 5 0x50540d6c 0x0 0x0 0
W 4 474.445180 5 0x50540d70 0x1062ae0d 0x0 0
W 4 474.445181 5 0x50540d74 0x0 0x0 0
W 4 474.445182 5 0x50540d78 0x1062af0d 0x0 0
W 4 474.445183 5 0x50540d7c 0x0 0x0 0
W 4 474.445184 5 0x50540d80 0x1062b00d 0x0 0
W 4 474.445185 5 0x50540d84 0x0 0x0 0
W 4 474.445186 5 0x50540d88 0x1062b10d 0x0 0
W 4 474.445187 5 0x50540d8c 0x0 0x0 0
W 4 474.445188 5 0x50540d90 0x1062b20d 0x0 0
W 4 474.445189 5 0x50540d94 0x0 0x0 0
W 4 474.445190 5 0x50540d98 0x1062b30d 0x0 0
W 4 474.445192 5 0x50540d9c 0x0 0x0 0
W 4 474.445193 5 0x50540da0 0x1062b40d 0x0 0
W 4 474.445194 5 0x50540da4 0x0 0x0 0
W 4 474.445195 5 0x50540da8 0x1062b50d 0x0 0
W 4 474.445196 5 0x50540dac 0x0 0x0 0
W 4 474.445197 5 0x50540db0 0x1062b60d 0x0 0
W 4 474.445198 5 0x50540db4 0x0 0x0 0
W 4 474.445199 5 0x50540db8 0x1062b70d 0x0 0
W 4 474.445200 5 0x50540dbc 0x0 0x0 0
W 4 474.445201 5 0x50540dc0 0x1062b80d 0x0 0
W 4 474.445202 5 0x50540dc4 0x0 0x0 0
W 4 474.445203 5 0x50540dc8 0x1062b90d 0x0 0
W 4 474.445204 5 0x50540dcc 0x0 0x0 0
W 4 474.445205 5 0x50540dd0 0x1062ba0d 0x0 0
W 4 474.445206 5 0x50540dd4 0x0 0x0 0
W 4 474.445207 5 0x50540dd8 0x1062bb0d 0x0 0
W 4 474.445208 5 0x50540ddc 0x0 0x0 0
W 4 474.445209 5 0x50540de0 0x1062bc0d 0x0 0
W 4 474.445210 5 0x50540de4 0x0 0x0 0
W 4 474.445211 5 0x50540de8 0x1062bd0d 0x0 0
W 4 474.445212 5 0x50540dec 0x0 0x0 0
W 4 474.445213 5 0x50540df0 0x1062be0d 0x0 0
W 4 474.445214 5 0x50540df4 0x0 0x0 0
W 4 474.445215 5 0x50540df8 0x1062bf0d 0x0 0
W 4 474.445217 5 0x50540dfc 0x0 0x0 0
W 4 474.445218 5 0x50540e00 0x1062c00d 0x0 0
W 4 474.445219 5 0x50540e04 0x0 0x0 0
W 4 474.445220 5 0x50540e08 0x1062c10d 0x0 0
W 4 474.445221 5 0x50540e0c 0x0 0x0 0
W 4 474.445222 5 0x50540e10 0x1062c20d 0x0 0
W 4 474.445223 5 0x50540e14 0x0 0x0 0
W 4 474.445224 5 0x50540e18 0x1062c30d 0x0 0
W 4 474.445225 5 0x50540e1c 0x0 0x0 0
W 4 474.445226 5 0x50540e20 0x1062c40d 0x0 0
W 4 474.445227 5 0x50540e24 0x0 0x0 0
W 4 474.445228 5 0x50540e28 0x1062c50d 0x0 0
W 4 474.445229 5 0x50540e2c 0x0 0x0 0
W 4 474.445230 5 0x50540e30 0x1062c60d 0x0 0
W 4 474.445231 5 0x50540e34 0x0 0x0 0
W 4 474.445232 5 0x50540e38 0x1062c70d 0x0 0
W 4 474.445233 5 0x50540e3c 0x0 0x0 0
W 4 474.445234 5 0x50540e40 0x1062c80d 0x0 0
W 4 474.445236 5 0x50540e44 0x0 0x0 0
W 4 474.445237 5 0x50540e48 0x1062c90d 0x0 0
W 4 474.445238 5 0x50540e4c 0x0 0x0 0
W 4 474.445239 5 0x50540e50 0x1062ca0d 0x0 0
W 4 474.445240 5 0x50540e54 0x0 0x0 0
W 4 474.445241 5 0x50540e58 0x1062cb0d 0x0 0
W 4 474.445242 5 0x50540e5c 0x0 0x0 0
W 4 474.445243 5 0x50540e60 0x1062cc0d 0x0 0
W 4 474.445244 5 0x50540e64 0x0 0x0 0
W 4 474.445245 5 0x50540e68 0x1062cd0d 0x0 0
W 4 474.445247 5 0x50540e6c 0x0 0x0 0
W 4 474.445248 5 0x50540e70 0x1062ce0d 0x0 0
W 4 474.445249 5 0x50540e74 0x0 0x0 0
W 4 474.445250 5 0x50540e78 0x1062cf0d 0x0 0
W 4 474.445251 5 0x50540e7c 0x0 0x0 0
W 4 474.445252 5 0x50540e80 0x1062d00d 0x0 0
W 4 474.445253 5 0x50540e84 0x0 0x0 0
W 4 474.445254 5 0x50540e88 0x1062d10d 0x0 0
W 4 474.445255 5 0x50540e8c 0x0 0x0 0
W 4 474.445256 5 0x50540e90 0x1062d20d 0x0 0
W 4 474.445257 5 0x50540e94 0x0 0x0 0
W 4 474.445258 5 0x50540e98 0x1062d30d 0x0 0
W 4 474.445259 5 0x50540e9c 0x0 0x0 0
W 4 474.445260 5 0x50540ea0 0x1062d40d 0x0 0
W 4 474.445261 5 0x50540ea4 0x0 0x0 0
W 4 474.445262 5 0x50540ea8 0x1062d50d 0x0 0
W 4 474.445264 5 0x50540eac 0x0 0x0 0
W 4 474.445265 5 0x50540eb0 0x1062d60d 0x0 0
W 4 474.445266 5 0x50540eb4 0x0 0x0 0
W 4 474.445267 5 0x50540eb8 0x1062d70d 0x0 0
W 4 474.445268 5 0x50540ebc 0x0 0x0 0
W 4 474.445269 5 0x50540ec0 0x1062d80d 0x0 0
W 4 474.445270 5 0x50540ec4 0x0 0x0 0
W 4 474.445271 5 0x50540ec8 0x1062d90d 0x0 0
W 4 474.445272 5 0x50540ecc 0x0 0x0 0
W 4 474.445273 5 0x50540ed0 0x1062da0d 0x0 0
W 4 474.445274 5 0x50540ed4 0x0 0x0 0
W 4 474.445275 5 0x50540ed8 0x1062db0d 0x0 0
W 4 474.445276 5 0x50540edc 0x0 0x0 0
W 4 474.445277 5 0x50540ee0 0x1062dc0d 0x0 0
W 4 474.445278 5 0x50540ee4 0x0 0x0 0
W 4 474.445280 5 0x50540ee8 0x1062dd0d 0x0 0
W 4 474.445281 5 0x50540eec 0x0 0x0 0
W 4 474.445282 5 0x50540ef0 0x1062de0d 0x0 0
W 4 474.445283 5 0x50540ef4 0x0 0x0 0
W 4 474.445284 5 0x50540ef8 0x1062df0d 0x0 0
W 4 474.445285 5 0x50540efc 0x0 0x0 0
W 4 474.445286 5 0x50540f00 0x1062e00d 0x0 0
W 4 474.445287 5 0x50540f04 0x0 0x0 0
W 4 474.445288 5 0x50540f08 0x1062e10d 0x0 0
W 4 474.445289 5 0x50540f0c 0x0 0x0 0
W 4 474.445290 5 0x50540f10 0x1062e20d 0x0 0
W 4 474.445291 5 0x50540f14 0x0 0x0 0
W 4 474.445292 5 0x50540f18 0x1062e30d 0x0 0
W 4 474.445293 5 0x50540f1c 0x0 0x0 0
W 4 474.445294 5 0x50540f20 0x1062e40d 0x0 0
W 4 474.445296 5 0x50540f24 0x0 0x0 0
W 4 474.445297 5 0x50540f28 0x1062e50d 0x0 0
W 4 474.445298 5 0x50540f2c 0x0 0x0 0
W 4 474.445299 5 0x50540f30 0x1062e60d 0x0 0
W 4 474.445300 5 0x50540f34 0x0 0x0 0
W 4 474.445301 5 0x50540f38 0x1062e70d 0x0 0
W 4 474.445302 5 0x50540f3c 0x0 0x0 0
W 4 474.445303 5 0x50540f40 0x1062e80d 0x0 0
W 4 474.445304 5 0x50540f44 0x0 0x0 0
W 4 474.445305 5 0x50540f48 0x1062e90d 0x0 0
W 4 474.445306 5 0x50540f4c 0x0 0x0 0
W 4 474.445307 5 0x50540f50 0x1062ea0d 0x0 0
W 4 474.445309 5 0x50540f54 0x0 0x0 0
W 4 474.445310 5 0x50540f58 0x1062eb0d 0x0 0
W 4 474.445311 5 0x50540f5c 0x0 0x0 0
W 4 474.445312 5 0x50540f60 0x1062ec0d 0x0 0
W 4 474.445313 5 0x50540f64 0x0 0x0 0
W 4 474.445314 5 0x50540f68 0x1062ed0d 0x0 0
W 4 474.445315 5 0x50540f6c 0x0 0x0 0
W 4 474.445316 5 0x50540f70 0x1062ee0d 0x0 0
W 4 474.445317 5 0x50540f74 0x0 0x0 0
W 4 474.445318 5 0x50540f78 0x1062ef0d 0x0 0
W 4 474.445319 5 0x50540f7c 0x0 0x0 0
W 4 474.445320 5 0x50540f80 0x1062f00d 0x0 0
W 4 474.445321 5 0x50540f84 0x0 0x0 0
W 4 474.445322 5 0x50540f88 0x1062f10d 0x0 0
W 4 474.445323 5 0x50540f8c 0x0 0x0 0
W 4 474.445325 5 0x50540f90 0x1062f20d 0x0 0
W 4 474.445326 5 0x50540f94 0x0 0x0 0
W 4 474.445327 5 0x50540f98 0x1062f30d 0x0 0
W 4 474.445328 5 0x50540f9c 0x0 0x0 0
W 4 474.445329 5 0x50540fa0 0x1062f40d 0x0 0
W 4 474.445330 5 0x50540fa4 0x0 0x0 0
W 4 474.445331 5 0x50540fa8 0x1062f50d 0x0 0
W 4 474.445332 5 0x50540fac 0x0 0x0 0
W 4 474.445333 5 0x50540fb0 0x1062f60d 0x0 0
W 4 474.445334 5 0x50540fb4 0x0 0x0 0
W 4 474.445335 5 0x50540fb8 0x1062f70d 0x0 0
W 4 474.445336 5 0x50540fbc 0x0 0x0 0
W 4 474.445337 5 0x50540fc0 0x1062f80d 0x0 0
W 4 474.445338 5 0x50540fc4 0x0 0x0 0
W 4 474.445339 5 0x50540fc8 0x1062f90d 0x0 0
W 4 474.445340 5 0x50540fcc 0x0 0x0 0
W 4 474.445341 5 0x50540fd0 0x1062fa0d 0x0 0
W 4 474.445342 5 0x50540fd4 0x0 0x0 0
W 4 474.445344 5 0x50540fd8 0x1062fb0d 0x0 0
W 4 474.445345 5 0x50540fdc 0x0 0x0 0
W 4 474.445346 5 0x50540fe0 0x1062fc0d 0x0 0
W 4 474.445347 5 0x50540fe4 0x0 0x0 0
W 4 474.445348 5 0x50540fe8 0x1062fd0d 0x0 0
W 4 474.445349 5 0x50540fec 0x0 0x0 0
W 4 474.445350 5 0x50540ff0 0x1062fe0d 0x0 0
W 4 474.445351 5 0x50540ff4 0x0 0x0 0
W 4 474.445352 5 0x50540ff8 0x1062ff0d 0x0 0
W 4 474.445353 5 0x50540ffc 0x0 0x0 0
R 4 474.920972 6 0x533000f0 0x1b76e865 0x0 0
R 4 474.921000 6 0x533000f0 0x1b76eb57 0x0 0
R 4 474.921007 6 0x533000f0 0x1b76f01f 0x0 0
R 4 474.921015 6 0x533000f0 0x1b76f0da 0x0 0
R 4 474.921024 6 0x533000f0 0x1b76f1ba 0x0 0
R 4 474.921032 6 0x533000f0 0x1b76f270 0x0 0
R 4 474.921039 6 0x533000f0 0x1b76f32b 0x0 0
R 4 474.921423 6 0x533000f0 0x1b7723e3 0x0 0
R 4 474.921446 6 0x533000f0 0x1b772642 0x0 0
R 4 474.921454 6 0x533000f0 0x1b7726fe 0x0 0
R 4 474.921461 6 0x533000f0 0x1b7727b9 0x0 0
R 4 474.921470 6 0x533000f0 0x1b772891 0x0 0
R 4 474.921478 6 0x533000f0 0x1b772946 0x0 0
R 4 474.921485 6 0x533000f0 0x1b772a00 0x0 0
R 4 474.921577 6 0x533000f0 0x1b7736cb 0x0 0
R 4 474.921601 6 0x533000f0 0x1b773922 0x0 0
R 4 474.921609 6 0x533000f0 0x1b7739d9 0x0 0
R 4 474.921643 6 0x533000f0 0x1b774121 0x0 0
R 4 474.921650 6 0x533000f0 0x1b7741da 0x0 0
R 4 474.921658 6 0x533000f0 0x1b774295 0x0 0
R 4 474.921666 6 0x533000f0 0x1b774364 0x0 0
R 4 474.921674 6 0x533000f0 0x1b774419 0x0 0
R 4 474.921681 6 0x533000f0 0x1b7744cf 0x0 0
R 4 474.921874 6 0x533000f0 0x1b775b4d 0x0 0
R 4 474.921913 6 0x533000f0 0x1b77630d 0x0 0
R 4 474.921920 6 0x533000f0 0x1b7763ca 0x0 0
R 4 474.921928 6 0x533000f0 0x1b776484 0x0 0
R 4 474.921937 6 0x533000f0 0x1b776554 0x0 0
R 4 474.921954 6 0x533000f0 0x1b776707 0x0 0
R 4 474.921962 6 0x533000f0 0x1b7767c1 0x0 0
R 4 474.921969 6 0x533000f0 0x1b77687f 0x0 0
R 4 474.922072 6 0x533000f0 0x1b77765c 0x0 0
R 4 474.922080 6 0x533000f0 0x1b777717 0x0 0
R 4 474.922087 6 0x533000f0 0x1b7777d2 0x0 0
R 4 474.922095 6 0x533000f0 0x1b777895 0x0 0
R 4 474.922103 6 0x533000f0 0x1b777949 0x0 0
R 4 474.922110 6 0x533000f0 0x1b777a05 0x0 0
R 4 474.922119 6 0x533000f0 0x1b777ae2 0x0 0
R 4 474.922127 6 0x533000f0 0x1b777b97 0x0 0
R 4 474.922134 6 0x533000f0 0x1b77804e 0x0 0
R 4 474.922142 6 0x533000f0 0x1b778110 0x0 0
R 4 474.922149 6 0x533000f0 0x1b7781c6 0x0 0
R 4 474.922157 6 0x533000f0 0x1b77827c 0x0 0
R 4 474.922165 6 0x533000f0 0x1b77834a 0x0 0
R 4 474.922173 6 0x533000f0 0x1b778401 0x0 0
R 4 474.922180 6 0x533000f0 0x1b7784b6 0x0 0
R 4 474.922197 6 0x533000f0 0x1b77864a 0x0 0
R 4 474.922204 6 0x533000f0 0x1b778701 0x0 0
R 4 474.922211 6 0x533000f0 0x1b7787b8 0x0 0
R 4 474.923910 6 0x533000f0 0x1b78629d 0x0 0
R 4 474.923933 6 0x533000f0 0x1b7864f8 0x0 0
R 4 474.923940 6 0x533000f0 0x1b7865b3 0x0 0
R 4 474.923948 6 0x533000f0 0x1b78666f 0x0 0
R 4 474.923957 6 0x533000f0 0x1b786752 0x0 0
R 4 474.923965 6 0x533000f0 0x1b786808 0x0 0
R 4 474.923972 6 0x533000f0 0x1b7868c3 0x0 0
R 4 474.923982 6 0x533000f0 0x1b7869ac 0x0 0
R 4 474.923990 6 0x533000f0 0x1b786a6d 0x0 0
R 4 474.923997 6 0x533000f0 0x1b786b2e 0x0 0
R 4 474.924006 6 0x533000f0 0x1b786bfb 0x0 0
R 4 474.924013 6 0x533000f0 0x1b7870b0 0x0 0
R 4 474.924021 6 0x533000f0 0x1b787166 0x0 0
R 4 474.924029 6 0x533000f0 0x1b787239 0x0 0
R 4 474.924036 6 0x533000f0 0x1b7872ef 0x0 0
R 4 474.924044 6 0x533000f0 0x1b7873af 0x0 0
R 4 474.924053 6 0x533000f0 0x1b78747b 0x0 0
R 4 474.924060 6 0x533000f0 0x1b787531 0x0 0
R 4 474.924068 6 0x533000f0 0x1b7875ec 0x0 0
R 4 474.924077 6 0x533000f0 0x1b7876c8 0x0 0
R 4 474.924084 6 0x533000f0 0x1b78777c 0x0 0
R 4 474.924092 6 0x533000f0 0x1b787837 0x0 0
R 4 474.924099 6 0x533000f0 0x1b7878fa 0x0 0
R 4 474.924107 6 0x533000f0 0x1b7879b4 0x0 0
R 4 474.924115 6 0x533000f0 0x1b787a6f 0x0 0
R 4 474.924123 6 0x533000f0 0x1b787b43 0x0 0
R 4 474.924131 6 0x533000f0 0x1b787bf9 0x0 0
R 4 474.924138 6 0x533000f0 0x1b7880b3 0x0 0
R 4 474.924159 6 0x533000f0 0x1b7882b4 0x0 0
R 4 474.924167 6 0x533000f0 0x1b78836e 0x0 0
R 4 474.924174 6 0x533000f0 0x1b788429 0x0 0
R 4 474.924245 6 0x533000f0 0x1b788ae5 0x0 0
R 4 474.924252 6 0x533000f0 0x1b788ba1 0x0 0
R 4 474.924260 6 0x533000f0 0x1b78905b 0x0 0
R 4 474.924268 6 0x533000f0 0x1b78911d 0x0 0
R 4 474.924276 6 0x533000f0 0x1b7891eb 0x0 0
R 4 474.924284 6 0x533000f0 0x1b7892a7 0x0 0
R 4 474.924292 6 0x533000f0 0x1b789379 0x0 0
R 4 474.924299 6 0x533000f0 0x1b78942f 0x0 0
R 4 474.924307 6 0x533000f0 0x1b7894e8 0x0 0
R 4 474.924315 6 0x533000f0 0x1b7895ac 0x0 0
R 4 474.924322 6 0x533000f0 0x1b789662 0x0 0
R 4 474.924330 6 0x533000f0 0x1b78971c 0x0 0
R 4 474.924338 6 0x533000f0 0x1b7897ea 0x0 0
R 4 474.924355 6 0x533000f0 0x1b789976 0x0 0
R 4 474.924362 6 0x533000f0 0x1b789a31 0x0 0
R 4 474.924370 6 0x533000f0 0x1b789aea 0x0 0
R 4 474.924378 6 0x533000f0 0x1b789bae 0x0 0
R 4 474.924385 6 0x533000f0 0x1b78a064 0x0 0
R 4 474.924393 6 0x533000f0 0x1b78a11e 0x0 0
R 4 474.924495 6 0x533000f0 0x1b78aaf0 0x0 0
R 4 474.924503 6 0x533000f0 0x1b78abac 0x0 0
R 4 474.924510 6 0x533000f0 0x1b78b067 0x0 0
R 4 474.924518 6 0x533000f0 0x1b78b12a 0x0 0
R 4 474.924525 6 0x533000f0 0x1b78b1df 0x0 0
R 4 474.924533 6 0x533000f0 0x1b78b295 0x0 0
R 4 474.924541 6 0x533000f0 0x1b78b365 0x0 0
R 4 474.924549 6 0x533000f0 0x1b78b41b 0x0 0
R 4 474.924556 6 0x533000f0 0x1b78b4d6 0x0 0
R 4 474.924573 6 0x533000f0 0x1b78b66a 0x0 0
R 4 474.924580 6 0x533000f0 0x1b78b720 0x0 0
R 4 474.924588 6 0x533000f0 0x1b78b7da 0x0 0
R 4 474.925142 6 0x533000f0 0x1b7900ec 0x0 0
R 4 474.925165 6 0x533000f0 0x1b790346 0x0 0
R 4 474.925172 6 0x533000f0 0x1b7903ff 0x0 0
R 4 474.925192 6 0x533000f0 0x1b7905d3 0x0 0
R 4 474.925199 6 0x533000f0 0x1b79068f 0x0 0
R 4 474.925207 6 0x533000f0 0x1b790749 0x0 0
R 4 474.925216 6 0x533000f0 0x1b790821 0x0 0
R 4 474.925231 6 0x533000f0 0x1b79099f 0x0 0
R 4 474.925238 6 0x533000f0 0x1b790a53 0x0 0
R 4 474.925246 6 0x533000f0 0x1b790b0d 0x0 0
R 4 474.925340 6 0x533000f0 0x1b79180f 0x0 0
R 4 474.925347 6 0x533000f0 0x1b7918ca 0x0 0
R 4 474.925355 6 0x533000f0 0x1b791985 0x0 0
R 4 474.925363 6 0x533000f0 0x1b791a49 0x0 0
R 4 474.925370 6 0x533000f0 0x1b791aff 0x0 0
R 4 474.925378 6 0x533000f0 0x1b791bba 0x0 0
R 4 474.925386 6 0x533000f0 0x1b79208a 0x0 0
R 4 474.925394 6 0x533000f0 0x1b792140 0x0 0
R 4 474.925401 6 0x533000f0 0x1b7921fb 0x0 0
R 4 474.925418 6 0x533000f0 0x1b79238c 0x0 0
R 4 474.925425 6 0x533000f0 0x1b792441 0x0 0
R 4 474.925433 6 0x533000f0 0x1b7924fd 0x0 0
R 4 474.925497 6 0x533000f0 0x1b792b1a 0x0 0
R 4 474.925504 6 0x533000f0 0x1b792bd5 0x0 0
R 4 474.925520 6 0x533000f0 0x1b793159 0x0 0
R 4 474.925527 6 0x533000f0 0x1b793213 0x0 0
R 4 474.925535 6 0x533000f0 0x1b7932ce 0x0 0
R 4 474.925543 6 0x533000f0 0x1b793391 0x0 0
R 4 474.925550 6 0x533000f0 0x1b793446 0x0 0
R 4 474.925558 6 0x533000f0 0x1b793501 0x0 0
R 4 474.925621 6 0x533000f0 0x1b793b17 0x0 0
R 4 474.925629 6 0x533000f0 0x1b793bd2 0x0 0
R 4 474.925637 6 0x533000f0 0x1b79408d 0x0 0
R 4 474.925645 6 0x533000f0 0x1b794152 0x0 0
R 4 474.925652 6 0x533000f0 0x1b794207 0x0 0
R 4 474.925659 6 0x533000f0 0x1b7942be 0x0 0
R 4 474.925935 6 0x533000f0 0x1b796517 0x0 0
R 4 474.925943 6 0x533000f0 0x1b7965fe 0x0 0
R 4 474.925951 6 0x533000f0 0x1b7966b9 0x0 0
W 4 474.925959 6 0x533000e0 0x200000 0x0 0
R 4 474.925975 6 0x53300000 0x1010000 0x0 0
R 4 474.925983 6 0x533000f0 0x1b7969d5 0x0 0
R 4 474.925991 6 0x533000f0 0x1b796a92 0x0 0
R 4 474.925999 6 0x533000f0 0x1b796b51 0x0 0
R 4 474.926023 6 0x533000f0 0x1b7971a6 0x0 0
R 4 474.926031 6 0x533000f0 0x1b797261 0x0 0
R 4 474.926038 6 0x533000f0 0x1b797318 0x0 0
W 4 474.926044 6 0x5330000c 0xfffffffe 0x0 0
W 4 474.926050 6 0x53300010 0xffffffff 0x0 0
W 4 474.926055 6 0x53300014 0x2 0x0 0
R 4 474.926063 6 0x53300014 0x80000002 0x0 0
R 4 474.926070 6 0x5330000c 0xffffffff 0x0 0
R 4 474.926078 6 0x533000f0 0x1b7976e4 0x0 0
R 4 474.926085 6 0x533000f0 0x1b79779e 0x0 0
R 4 474.926093 6 0x533000f0 0x1b797859 0x0 0
R 4 474.926102 6 0x533000f0 0x1b797944 0x0 0
R 4 474.926121 6 0x533000f0 0x1b797b09 0x0 0
R 4 474.926128 6 0x533000f0 0x1b797bc5 0x0 0
R 4 474.926136 6 0x533000f0 0x1b798080 0x0 0
R 4 474.926145 6 0x533000f0 0x1b79815a 0x0 0
R 4 474.926152 6 0x533000f0 0x1b798212 0x0 0
R 4 474.926160 6 0x533000f0 0x1b7982ce 0x0 0
R 4 474.926884 6 0x533000f0 0x1b79e070 0x0 0
R 4 474.926888 6 0x533000f0 0x1b79e0ca 0x0 0
R 4 474.926891 6 0x533000f0 0x1b79e114 0x0 0
R 4 474.926894 6 0x533000f0 0x1b79e16e 0x0 0
R 4 474.926897 6 0x533000f0 0x1b79e1b9 0x0 0
R 4 474.926900 6 0x533000f0 0x1b79e203 0x0 0